doc_text,sentence_id
"In a statement on 2 July, the Secretary -General called upon protesters to avoid acts of violence and upon all Libyan actors to refrain from actions that could undermine stability.",S/2022/632_PAR_5_SEN_4
He further urged Libyan leaders to overcome the political deadlock that was deepening divisions and negatively affecting the country ’s economy and stressed the need to build upon the considerable progress achieved during talks i n Cairo and Geneva convened under the auspices of the United Nations.,S/2022/632_PAR_5_SEN_5
"On 31 July, the Special Adviser concluded her assignment.",S/2022/632_PAR_6_SEN_1
"On 1 August, the Secretary -General issued a statement to thank the Special Adviser for her service and dedication, recognizin g her remarkable ability to foster conditions conducive to dialogue and consensus among all stakeholders, which had led to key achievements in the political, security and economic dialogue tracks.",S/2022/632_PAR_6_SEN_2
A.,S/2022/632_PAR_6_SEN_3
Implementation of the intra -Libyan dialogue tracks,S/2022/632_PAR_6_SEN_4
"Regarding the political track, United Nations efforts continued to focus on enabling the holding of credible, transparent and inclusive elections as soon as possible on the basis of an agreed constitutional framework in order to realize the aspiration s of over 2.8 million Libyans who had registered to vote.",S/2022/632_PAR_7_SEN_1
"The Special Adviser, supported by UNSMIL, continued to lead good offices and mediation efforts to maintain the momentum in the intra -Libyan political, security -related and economic dialogue tracks.",S/2022/632_PAR_7_SEN_2
"She also continued to hold broad consultations on the constitutional framework for elections and the way forward for the electoral process with a wide spectrum of national stakeholders, including representatives of national and municipal institutions, poli tical parties and security actors, as well as with parliamentary and presidential candidates.",S/2022/632_PAR_7_SEN_3
"On 8 June, the Special Adviser discussed plans for the third round of talks of the joint committee, composed of representatives of the House of Representative s and the High State Council, with Mr. Issa, in Al Qubbah, and the Mr. Mishri, in Tripoli.",S/2022/632_PAR_8_SEN_1
"In a telephone conversation with the Special Adviser on 11 June, the President of the Presidency Council expressed the Council ’s full support for United Nations - facilitated efforts to reach agreement on a constitutional basis for elections, stressing the importance of fulfilling the will of Libyans to elect their representatives.",S/2022/632_PAR_8_SEN_2
"On 20 June, the third and final round of talks concluded in Cairo.",S/2022/632_PAR_9_SEN_1
"Throughout the tal ks, representatives of the two chambers demonstrated an unprecedented level of cooperation.",S/2022/632_PAR_9_SEN_2
"They reached agreement on critical elements of the constitutional architecture, including the establishment of a bicameral legislature and the distribution of seats for the two legislative chambers; the division of responsibility among the President, the Prime Minister, the Cabinet and local government; the specific form of decentralization, including the delineation of the number of governorates and their powers; an d the definition of a mechanism for natural resource distribution at all levels of governance.",S/2022/632_PAR_9_SEN_3
"However, agreement was not reached on transitional measures Page 3 governing the period leading to national elections, therefore requiring further consultations.",S/2022/632_PAR_9_SEN_4
The Sp ecial Adviser thus called on the leadership of the two chambers to meet within 10 days to bridge the outstanding gaps.,S/2022/632_PAR_9_SEN_5
"On 23 June, Mr. Issa and the Mr. Mishri accepted the Special Adviser ’s invitation to meet in Geneva.",S/2022/632_PAR_9_SEN_6
"From 28 to 30 June, the United Nations facilitated the constitutional track of a high -level meeting on Libya, held in Geneva, between Mr. Issa and Mr. Mishri.",S/2022/632_PAR_10_SEN_1
"The leaders of the two chambers expressed support for the outcome of the Cairo talks and charted a road map, with timelines and a series of steps leading to the holding of national elections.",S/2022/632_PAR_10_SEN_2
"However, the leadership of the two chambers was unable to agree on one final matter, namely the eligibility requirements for candidates in the first transitional presidential elections.",S/2022/632_PAR_10_SEN_3
"With regard to the economic track, UNSMIL continued to support efforts to advance the reform and reunification of the Central Bank of Libya and to promote transparency in public expenditure, as well as reliable funding for the priority needs of the Libyan people.",S/2022/632_PAR_11_SEN_1
An international consulting firm continued to provide technical assistance to implement the recommendations issued in 2021 following the United Nations -facilitated international audit for the reform and reunification o f the Bank.,S/2022/632_PAR_11_SEN_2
"On 14 and 15 June, the House of Representatives met in Sirte to deliberate on a budget proposal presented by Mr. Bashagha.",S/2022/632_PAR_12_SEN_1
"The spokesperson for the House of Representatives later announced that the budget proposal had been adopted with 103 votes in favour, including 5 votes submitted electronically.",S/2022/632_PAR_12_SEN_2
"Independent verification of the vote, which took place in a closed session, was not possible.",S/2022/632_PAR_12_SEN_3
Some members of the House of Representatives who did not attend the session questioned the reported number of participants in the session and the use of electronic voting.,S/2022/632_PAR_12_SEN_4
"On 16 June, the Government of National Unity of Mr. Al Dabiba rejected the decision of the House of Representatives, by which the budget submitted by Mr. Bashagha was approved, and reit erated that it would only transfer power to a new elected government.",S/2022/632_PAR_12_SEN_5
"On 14 July, Mr. Al Dabiba announced the appointment of a new Chair and Board of Directors of the National Oil Corporation, replacing the long -serving Mustafa Sanalla with Farhat Beng dara, who had served as Governor of the Central Bank from 2006 to 2011.",S/2022/632_PAR_13_SEN_1
Mr. Sanalla legally challenged the decision.,S/2022/632_PAR_13_SEN_2
"On 15 July, the newly appointed Chair announced the reopening of the oil fields and oil ports that had been closed since 16 April and had c ost the country $4 billion in lost revenue.",S/2022/632_PAR_13_SEN_3
"Concerning the security track, the Government of Spain and the Toledo International Centre for Peace, with the assistance of UNSMIL, organized a technical workshop on disarmament, demobilization and reintegr ation with Libyan and international actors.",S/2022/632_PAR_14_SEN_1
"The meeting was held in Toledo, Spain, on 23 and 24 May.",S/2022/632_PAR_14_SEN_2
"At the event, the Special Adviser underlined the need to restore the State monopoly over the country ’s security forces.",S/2022/632_PAR_14_SEN_3
"Participants agreed on the need to coordinate and implement the preparatory phase of a disarmament, demobilization and reintegration programme in Libya.",S/2022/632_PAR_14_SEN_4
"On the margins of the workshop, the Special Adviser and UNSMIL facilitated the first joint meeting of the 5+5 Joint Military Commission si nce the eastern members of the Commission had suspended their participation in April over delays in the payment of Libyan National Army salaries by the Government of National Unity ( S/2022/409 , paras.",S/2022/632_PAR_14_SEN_5
28 and 29).,S/2022/632_PAR_14_SEN_6
"UNSMIL continued to support the 5+5 Joint Military Commission in the implementation of the ceasefire agreement of October 2020 and the operationalization of the action plan for a gradual, balanced and sequenced process of withdrawal of mercenari es, foreign fighters and foreign forces from Libyan territory.",S/2022/632_PAR_15_SEN_1
"As agreed by the Commission, the clearance of mines and improvised explosive devices required for the reopening of the southern road between Abu Qurayn and Jufrah began along the western part o f the road to allow the free movement of peoples and merchandise.",S/2022/632_PAR_15_SEN_2
"Page 4 In addition, UNSMIL and the Mine Action Service continued to support the clearance of mines and improvised explosive devices along the eastern part of the road, in coordination with the Comm ission ’s mine action subcommittee.",S/2022/632_PAR_15_SEN_3
"As at 5 August, 100 km of road had been cleared.",S/2022/632_PAR_15_SEN_4
Further coordination with the Libyan National Army Command is needed in order to complete the remaining clearance work on the road.,S/2022/632_PAR_15_SEN_5
"On 16 June, the Chiefs of General St aff of the Libyan Army and of the Libyan National Army, Lieutenant General Mohammed al -Haddad and General Mohammed Nadhouri respectively, met in Cairo, together with the 5+5 Joint Military Commission and the Special Adviser.",S/2022/632_PAR_16_SEN_1
Lieutenant General al -Haddad we lcomed United Nations efforts to facilitate agreement between the House of Representatives and the High State Council on a constitutional basis for elections.,S/2022/632_PAR_16_SEN_2
The two sides also agreed to resume meetings of the Commission and between the heads of the milit ary from both sides on Libyan soil.,S/2022/632_PAR_16_SEN_3
"The Special Adviser also facilitated a meeting of the Commission with the joint committee of the House of Representatives and the High State Council, in Cairo on 16 June, to address the remaining challenges to the reunif ication of the armed forces and the full implementation of the ceasefire agreement.",S/2022/632_PAR_16_SEN_4
B.,S/2022/632_PAR_16_SEN_5
International Follow -up Committee on Libya of the Berlin process,S/2022/632_PAR_16_SEN_6
The International Follow -up Committee on Libya of the Berlin process and its working groups continued to serve as the overall framework for international support for the intra -Libyan dialogue tracks.,S/2022/632_PAR_17_SEN_1
"On 7 June, the security working group, co -chaired by the United Nations, France, Italy, Türkiye, the United Kingdom and the African Union , met with the 5+5 Joint Military Commission in Tunis to discuss steps for proceeding with the operationalization of the action plan for a gradual, balanced and sequenced withdrawal of mercenaries, foreign fighters and foreign forces.",S/2022/632_PAR_18_SEN_1
"The security working group also declared its intention to support the implementation of a disarmament, demobilization and reintegration programme, as envisaged in article 4 of the ceasefire agreement, once security conditions permitted it.",S/2022/632_PAR_18_SEN_2
"In a statement made on 16 June, the Co -Chairs of the international humanitarian law and human rights working group (the United Nations, the Netherlands and Switzerland) called upon the Human Rights Council to extend the mandate of the Independent Fact -Finding Mission on Libya so as to en able it to continue its critical work to advance human rights, sustainable peace and rights -based national reconciliation.",S/2022/632_PAR_19_SEN_1
"On behalf of the Co -Chairs of the working group, UNSMIL convened three rounds of dialogue with civil society actors and human rights defenders on human rights challenges, on 7, 12 and 21 June.",S/2022/632_PAR_19_SEN_2
"According to the participants, the main obstacles to advancing human rights were the political divide and constitutional challenges; armed groups and militias and the proliferation of weapons; the lack of accountability for human rights violations against Libyans, migrants and asylum -seekers; attacks on the freedom of expression and association; and violence against women.",S/2022/632_PAR_19_SEN_3
"The economic working group, co -chaired by the United Nations, Egypt, the European Union and the United States, sought the views of relevant Libyan institutions on the parameters of a possible short -term financing mechanism to fund, in a consensual and transparent manner, critical priorities and needs, including with regard to the National Oil Corporation.",S/2022/632_PAR_20_SEN_1
"The Co -Chairs met in Tunis, on 26 May, to discuss the modalities for the establishment and operationalization of such a funding mechanism.",S/2022/632_PAR_20_SEN_2
"Subsequently, draft terms of reference for a proposed Libyan special committee for over sight were circulated by the United States for consideration by senior Libyan officials of the House of Representatives Finance Committee, the Presidency Council, the Ministry of Finance, the Audit Bureau and the Administrative Control Authority, as well a s the other Co -Chairs of the working group.",S/2022/632_PAR_20_SEN_3
Page 5 C.,S/2022/632_PAR_20_SEN_4
International and regional engagement,S/2022/632_PAR_20_SEN_5
"During the reporting period, the Special Adviser and UNSMIL held regular consultations with regional and international stakeholders, both in Libya and abroad, on th e three intra -Libyan dialogue tracks.",S/2022/632_PAR_21_SEN_1
The Special Adviser and UNSMIL participated upon request in meetings organized by Member States to provide briefings on the developments in Libya and updates on the status of United Nations mediation efforts.,S/2022/632_PAR_21_SEN_2
"On 1 June, the Special Adviser, together with the Assistant Secretary -General and Mission Coordinator of UNSMIL and the United Nations Assistant Secretary - General, Resident and Humanitarian Coordinator for Libya, gave briefings to representatives of the intern ational diplomatic community.",S/2022/632_PAR_22_SEN_1
"On 9 and 10 June, the Special Adviser visited Algeria for meetings with the Minister of Foreign Affairs and senior officials on the Libyan political process and progress made on the constitutional track.",S/2022/632_PAR_22_SEN_2
"On 22 June, the Specia l Adviser met, in Oslo, with the Norwegian and German Special Representatives for Libya to discuss the next steps regarding the constitutional track.",S/2022/632_PAR_22_SEN_3
"From 22 to 24 June, an African Union delegation headed by the Minister for Foreign Affairs of the Con go, Jean -Claude Gakosso, representing the Chairperson of the African Union High -level Committee on Libya, visited Libya and met with senior Libyan officials, as well as with UNSMIL.",S/2022/632_PAR_23_SEN_1
The delegation presented a proposal for national reconciliation grounded i n the principles of Libyan ownership and inclusiveness.,S/2022/632_PAR_23_SEN_2
"On 5 July, the Special Adviser travelled to Paris where she met with the French Special Envoy for Libya and senior officials.",S/2022/632_PAR_24_SEN_1
"On 21 July, the Special Adviser travelled to Istanbul, Türkiye, to di scuss the progress made on the constitutional track during a gathering of Member States organized by Türkiye.",S/2022/632_PAR_24_SEN_2
Situation in the western region,S/2022/632_PAR_24_SEN_3
"Continued political divisions contributed to a volatile security environment in Tripoli and across wes tern Libya, including as a result of demonstrations of support by security actors for Mr. Al Dabiba or Mr. Bashagha, and in response to Mr. Bashagha ’s attempt to enter Tripoli on 17 May.",S/2022/632_PAR_25_SEN_1
"In Tripoli, there was an increased number of intermittent clashes bet ween armed groups, as well as sporadic shootings, including in densely populated areas.",S/2022/632_PAR_25_SEN_2
"On 26 May, a large convoy of Zintani forces supportive of Mr. Bashagha moved from Aziziyah to military camps south of Tripoli.",S/2022/632_PAR_26_SEN_1
"In a statement issued that day, the Ministry of Defence denounced “attempts to mobilize the military for a war driven by a partisan political agenda ”.",S/2022/632_PAR_26_SEN_2
"In addition, forces affiliated with the Government of National Unity strengthened their positions in central Tripoli, as well as in Tarhunah and Bani Walid.",S/2022/632_PAR_26_SEN_3
"On 9 June, one fighter was reportedly killed and two civilians injured in armed clashes in central Tripoli between members of the Nawasi Brigade and elements affiliated to the Stability Support Apparatus.",S/2022/632_PAR_27_SEN_1
"In a statement issued on 10 June , UNSMIL called upon political and security actors to exercise maximum restraint.",S/2022/632_PAR_27_SEN_2
"On 22 June, four armed elements and one civilian were reportedly killed in clashes between the Special Deterrence Force and the Stability Support Apparatus in central Tripoli .",S/2022/632_PAR_27_SEN_3
"At the end of June, tensions among security actors spiked amid discussions among political actors on the continued validity of the road map of the Libyan Political Dialogue Forum and the legitimacy of the Government of National Unity.",S/2022/632_PAR_28_SEN_1
"On 19 and 20 Ju ne, Zintani forces based in southern Tripoli were further reinforced Page 6 by military units from Zintan and Aziziyah.",S/2022/632_PAR_28_SEN_2
"The show of force was triggered by Mr. Al Dabiba ’s dismissal of Western Military Commander, General Osama al-Juwaili, from his position as the head of military intelligence in the aftermath of the Mr. Bashagha ’s attempt to enter Tripoli on 17 May.",S/2022/632_PAR_28_SEN_3
"In an apparent deterrence measure, forces loyal to the Government of National Unity were deployed around the premises of Mr. Al Dabiba ’s office.",S/2022/632_PAR_28_SEN_4
"On 21 June, the Ministry of Defence announced a state of emergency in the capital city.",S/2022/632_PAR_28_SEN_5
"Following a statement made by Mr. Bashagha on 9 July, in which he announced that his cabinet would begin operating from Tripoli, a series of military movements and mobil izations were reported in the capital city and the level of alert was again raised among the armed forces in western Libya.",S/2022/632_PAR_29_SEN_1
"On 13 July, several commanders of armed groups gathered in Martyrs ’ Square in Tripoli and read a joint statement, warning that the s ecurity of Tripoli was “a red line ” and that they would confront any military forces attempting to “cause chaos ” in the capital.",S/2022/632_PAR_29_SEN_2
The commanders further rejected a new political transition phase and called for elections as the only solution to the political crisis.,S/2022/632_PAR_29_SEN_3
E.,S/2022/632_PAR_29_SEN_4
Situation in the eastern region,S/2022/632_PAR_29_SEN_5
"On 11 June, during a gathering in Suluq, south -east of Benghazi, tribal elders issued a communiqué calling for the removal of “all institutions whose term has expired ” and the simultaneous conduct of presidential and parliamentary elections by the end of 2 022.",S/2022/632_PAR_30_SEN_1
"As part of the demonstrations that occurred across Libya on 1 July, demonstrators in Tubruq stormed the premises of the House of Representatives, demanding the chamber ’s dissolution while causing damage and setting fire to the building.",S/2022/632_PAR_31_SEN_1
F.,S/2022/632_PAR_31_SEN_2
Situation in the southern region,S/2022/632_PAR_31_SEN_3
"Following armed clashes in Chad near the border with Libya from 23 to 27 May, the Libyan National Army intensified its counter -terrorism operations, with additional units being deployed near the border to limit the impact on Libyan territory of the fighting on the Chadian side.",S/2022/632_PAR_32_SEN_1
"On 1 June, the Army stated that reinforcements had been sent to Qatrun and Murzuq to prevent the infiltration of terrorists or criminals into Libya; however, the increased military presence triggere d tensions with some members of the Tebu tribe.",S/2022/632_PAR_32_SEN_2
"To defuse any potential feud with local Tebu elements, local Tebu military components were eventually incorporated into the Libyan National Army and assigned the task of border security patrols.",S/2022/632_PAR_32_SEN_3
G.,S/2022/632_PAR_32_SEN_4
Violent extremist organizations,S/2022/632_PAR_32_SEN_5
"On 30 May, the Libyan National Army announced the capture of alleged Da ’esh Commander, Abu Muaz al -Tashani, south of Qatrun.",S/2022/632_PAR_33_SEN_1
"During the same operation, an unspecified number of Da ’esh elements were also reportedly killed.",S/2022/632_PAR_33_SEN_2
"On 18 June, the 444 Brigade reported the arrest of alleged Da ’esh Commander, Mustafa Bin Della, in Bani Walid.",S/2022/632_PAR_34_SEN_1
H.,S/2022/632_PAR_34_SEN_2
Economic situation,S/2022/632_PAR_34_SEN_3
UNSMIL continued to work with Libyan stakeholders and international interlocutors to identify ways to improve tra nsparency and facilitate the flow of Page 7 funding from the escrow account of the National Oil Corporation to the Central Bank for the payment of salaries and other key government expenditures amid sharp increases in the prices of basic commodities and shortages of electricity and fuel.,S/2022/632_PAR_35_SEN_1
"On 15 June, the House of Representatives reportedly approved the 89 billion Libyan dinar ($18.3 billion) budget proposal submitted by Mr. Bashagha.",S/2022/632_PAR_36_SEN_1
The vote was contested by some members of the House and other Libyan actors on procedural grounds (see paragraph 13 above).,S/2022/632_PAR_36_SEN_2
"The partial shutdown of the oil sector that began on 16 April and that resulted in the curtailment of oil production and related port closures, reduced Libyan oil exports by two thirds and cost the country nearly $4 billion in lost oil revenues.",S/2022/632_PAR_37_SEN_1
"In addition, the disagreements over the control and use of public funds that had triggered the partial shutdown continued.",S/2022/632_PAR_37_SEN_2
"A heatwave in late June overburdened the country ’s power grid, leading to power outages lasting as long as 10 to 12 hours at a time across the country.",S/2022/632_PAR_38_SEN_1
"Protests erupted over the outages and the perceived inequity in their duration, culminating in country -wide demonstrations, held on 1 July, demanding elections and responsive service delivery.",S/2022/632_PAR_38_SEN_2
"On 15 July, the force majeure was lifted on all the oil fields and ports affected by the shutdown of 16 April.",S/2022/632_PAR_39_SEN_1
"Oil production resumed incrementally and, on 19 July, oil began to be loaded at previously closed ports.",S/2022/632_PAR_39_SEN_2
"By 17 August, oil production had risen to 1.2 million daily barrels from 860,000 on 5 July.",S/2022/632_PAR_39_SEN_3
"The resumption of oil production has provided much needed relief to a population that has experienced intermittent power cuts of long duration, an increase in the prices of basic foo d items and goods, and inadequate basic services.",S/2022/632_PAR_39_SEN_4
Other Mission activities A.,S/2022/632_PAR_39_SEN_5
Electoral support,S/2022/632_PAR_39_SEN_6
The UNSMIL -led integrated electoral team continued to provide technical support and advice to the High National Elections Commission.,S/2022/632_PAR_40_SEN_1
"On 26 Jun e, the Chair of the Commission indicated his readiness to conduct an electoral process, be it a general election or a referendum.",S/2022/632_PAR_40_SEN_2
The Commission estimated that it would require approximately 10 weeks to conduct a constitutional referendum following receipt of a new referendum law and draft constitution from the House of Representatives.,S/2022/632_PAR_40_SEN_3
"The process of reviewing the existing digital voter registry, which has some 2.8 million voters, continued throughout the reporting period.",S/2022/632_PAR_41_SEN_1
"To improve the credibility of the registry, the High National Elections Commission considered new technical measures and a new public information campaign.",S/2022/632_PAR_41_SEN_2
"The UNSMIL -led integrated electoral team also worked on initiatives to counter misinformation and hate speech during electo ral processes, with a special emphasis on protecting the participation of women candidates.",S/2022/632_PAR_42_SEN_1
B.,S/2022/632_PAR_42_SEN_2
"Human rights, transitional justice and rule of law",S/2022/632_PAR_42_SEN_3
"Electricity and fuel shortages, rising food prices and deteriorating living conditions significantl y affected Libyans ’ access to basic services, including water and sanitation, food, health care and education.",S/2022/632_PAR_43_SEN_1
UNSMIL received reports of a 1 -year- old girl who died in a Tripoli medical facility on 29 June because of a lack of oxygen caused by prolonged power outages.,S/2022/632_PAR_43_SEN_2
"There were also reports of a man operating a Page 8 small generator in the streets of Benghazi, on 25 June, in order to power an oxygen machine to enable his son to breathe.",S/2022/632_PAR_43_SEN_3
"Power cuts affected the distribution of 6,000 doses of essential medicines requiring cold stora ge, such as insulin, and vital surgeries were cancelled.",S/2022/632_PAR_43_SEN_4
"The country ’s water supply systems were also affected, leading to an increase in cases of disease.",S/2022/632_PAR_43_SEN_5
Restrictions on civic space deepened during the reporting period.,S/2022/632_PAR_44_SEN_1
"During the protests on 1 and 2 July, UNSMIL monitored reports of the enforced disappearance and arbitrary detention of dozens of individuals, including minors, who peacefully demonstrated and observed a sharp increase in hate speech and incitement to violence on social media against c ivil society organizations and rights advocates, in particular women activists, accusing them of contravening Libyan values.",S/2022/632_PAR_44_SEN_2
"On 23 July, the Ministry of Health confirmed that 16 civilians, including four children, had been killed and 52 civilians had b een injured during clashes in Tripoli from 21 to 22 July.",S/2022/632_PAR_45_SEN_1
