doc_text,sentence_id
UNSMIL provided technical assistanc e to the Ministry of Justice and the Supreme Judicial Council to screen and release detainees as a mitigation measure against the spread of the COVID -19 pandemic.,S/2021/62_PAR_52_SEN_1
"In the context of the UNSMIL -UNDP Police and Security Joint Programme, technical support was also provided to the Judicial Police to increase their capacities and adopt standard operating procedures to enhance the management and the organization of correction facilities.",S/2021/62_PAR_52_SEN_2
"UNSMIL, in cooperation with the Ministry of Justice and the Judicial Pol ice, advocated for the provision of basic health care to prisoners in an effort to stem the spread of COVID -19.",S/2021/62_PAR_53_SEN_1
"Subsequently, health -care units were operationalized in several prisons, and some correction facilities were sanitized.",S/2021/62_PAR_53_SEN_2
"Medical screening was conducted and visitation procedures were reviewed, in order to prevent the spread of the virus in these institutions.",S/2021/62_PAR_53_SEN_3
"From August to October 2020, the Ministry of Justice and the Public Prosecution Office announced that more than 1,400 individuals had b een released from prisons across the country, bringing the total to 3,900 in 2020.",S/2021/62_PAR_54_SEN_1
The release is a measure to stem the spread of COVID -19.,S/2021/62_PAR_54_SEN_2
"Libyan authorities declined to provide the names of those released, including women and children, and UNSMIL has not been able to verify the reported releases.",S/2021/62_PAR_54_SEN_3
Groups in vulnerable situations Migrants and refugees,S/2021/62_PAR_54_SEN_4
"Migrants and refugees, including women and children, continued to be routinely subjected to discrimination, arrest, arbitrary detention, torture and other human rights violations and abuses.",S/2021/62_PAR_55_SEN_1
"UNSMIL received reports of torture, deprivation of food and health care, enforced disappearances and sexual and gender -based violence against persons detained in the Suq al -Khamis, Abu Salim, Nasir and Abu Isa centres operated by the Directorate for Combating Illegal Migration.",S/2021/62_PAR_55_SEN_2
Men and boys were allegedly routinely shot at or severely beaten by guards trying to pressure families for ransom Page 10 pay.,S/2021/62_PAR_55_SEN_3
"Detainees were also shot at when attempting to escape, resulting in injuries and deaths.",S/2021/62_PAR_55_SEN_4
"On 28 September, around 355 migrants and asylum seekers, including 258 men, 57 women and 40 children, were arrested by security forces at their homes, places of work and other gathering places in Ujaylat and the outskirts of Sabra tah.",S/2021/62_PAR_56_SEN_1
"The migrants and asylum seekers were taken to the Dahman assembly point in Sabratah, controlled by the Directorate for Combating Illegal Migration and the Security Directorate under the Ministry of Defence.",S/2021/62_PAR_56_SEN_2
"During the arrests, two males of unconfirmed age were shot and injured, and two women were reportedly sexually assaulted.",S/2021/62_PAR_56_SEN_3
"On 1 October, at least three migrants were reportedly killed by armed men at the Dahman assembly point during a riot to protest the lack of food, medical care and potable water.",S/2021/62_PAR_56_SEN_4
"There were also continued reports of large -scale deportations by officials of the Directorate for Combating Illegal Migration along the southern border of Libya with Chad and Sudan under the so -called “emergency procedures”, raising concerns of collec tive expulsion and possible cases of refoulement, with the Kufrah detention centre becoming a de facto deportation centre.",S/2021/62_PAR_57_SEN_1
"A newly established Directorate desert patrol unit headquartered in Assah, reportedly initiated regular patrols and intensified secur ity checks along the Libyan border with Algeria, raising concerns as to discriminatory profiling and increased expulsions outside of process and procedural safeguards.",S/2021/62_PAR_57_SEN_2
"During the reporting period, the number of individuals held in migrant detention centres increased owing to more interceptions or rescues at sea by the Libyan authorities and the closure of sea routes to migrants and refugees through interception on land, preventing their departure.",S/2021/62_PAR_58_SEN_1
"In 2020, more than 11,900 migrants and refugees were intercepted at sea, disembarked in Libya and frequently transferred to arbitrary detention in abusive conditions, while others have disappeared altogether.",S/2021/62_PAR_58_SEN_2
"This represents an increase, compared with the 9,200 intercepted throughout 2019.",S/2021/62_PAR_58_SEN_3
"There are currently more than 2,300 persons in eight officially registered detention centres in Libya, of whom 695 are persons of concern to the United Nations High Commissioner for Refugees (U NHCR).",S/2021/62_PAR_58_SEN_4
"On 12 November, three shipwrecks were recorded, in which over 100 people were killed.",S/2021/62_PAR_59_SEN_1
"On 15 November, a vessel carrying migrants off the coast of Khums in western Libya sank, killing at least 74 migrants.",S/2021/62_PAR_59_SEN_2
"UNSMIL received multiple reports of fai lure to assist and pushbacks of migrant boats in the central Mediterranean, both by relevant international authorities and the Libyan Coast Guard.",S/2021/62_PAR_59_SEN_3
The United Nations continued to provide life -saving assistance at disembarkation points and monitoring to ide ntify those in need of international protection.,S/2021/62_PAR_59_SEN_4
Women and children,S/2021/62_PAR_59_SEN_5
"Approximately 278 women reportedly remain in detention centres nominally under the authority of the Ministry of Justice, while an estimated 200 women are held at Mitiga detention centre.",S/2021/62_PAR_60_SEN_1
"UNSMIL received multiple allegations of sexual violence, torture and ill -treatment and other sexual abuse by guards against women and children suspected of being linked to ISIL fighters.",S/2021/62_PAR_60_SEN_2
Some 69 children remain detained with their mothers in Judayd ah prison.,S/2021/62_PAR_60_SEN_3
Violence against women and children is further compounded by the lack of female guards at prisons and detention centres.,S/2021/62_PAR_60_SEN_4
"Cases of sexual and gender -based violence remain underreported in Libya owing to fear of reprisal, intimidation and mis placed stigma related to underlying discriminatory gender norms.",S/2021/62_PAR_61_SEN_1
"To improve documentation of conflict -related sexual violence, UNSMIL established the monitoring, analysis and reporting arrangements on conflict -related sexual violence in Libya, in line with resolution 1960 (2010) .",S/2021/62_PAR_61_SEN_2
Page 11 Support for judicial authorities,S/2021/62_PAR_61_SEN_3
"Despite ongoing challenges, the unified administration of justice saw signs of improvement, demonstrated by the collaboration of member s of the newly elected Supreme Judicial Council and the resumption of legal proceedings in the south, and in Sirte and Darnah.",S/2021/62_PAR_62_SEN_1
"Latest figures indicate that, from August to November, following UNSMIL advocacy, 11 court hearings took place inside Judaydah pr ison in Tripoli, resulting in the release of eight detainees.",S/2021/62_PAR_62_SEN_2
Human rights due diligence policy,S/2021/62_PAR_62_SEN_3
"The United Nations system in Libya continued to implement the human rights due diligence policy on United Nations support to non -United Nations securi ty forces (see A/67/775 -S/2013/110 , annex), with a view to preventing and mitigating the identified risks of grave violations of international humanitarian law, human rights law or refugee law.",S/2021/62_PAR_63_SEN_1
"Owing to the CO VID -19 pandemic, United Nations agencies, funds and programmes focused their activities on life -saving programmes.",S/2021/62_PAR_63_SEN_2
Security sector Implementation of the ceasefire,S/2021/62_PAR_63_SEN_3
"The United Nations continued to facilitate and support the Libyan -led and owned negotiations on the implementation of the ceasefire agreement, including the development of a monitoring mechanism.",S/2021/62_PAR_64_SEN_1
"The Secretariat established a Libya planning team chaired by the Department of Political and Peacebuilding Affairs, which includes representatives of relevant components of the Department of Operational Support, the Department of Peace Operations, the Office of Legal Affairs and UNSMIL.",S/2021/62_PAR_64_SEN_2
"A separate report was submitted to the Security Council on 29 December 2020 ( S/2020/1309 ) on options for an effective ceasefire monitoring mechanism under the auspices of the United Nations, in accordance with resolution 2542 (2020) .",S/2021/62_PAR_64_SEN_3
Arms and ammunition management,S/2021/62_PAR_64_SEN_4
UNSMIL continued to assist Libyan communities and authorities in mitigating the threat from explosive ordnance and the proliferation of weapons and ammunition through technical assistance and support from the Mine Action Service.,S/2021/62_PAR_65_SEN_1
Activities were focused on the disposal of explosive ordnance and battle area clearance in southern Tripoli and Misratah.,S/2021/62_PAR_65_SEN_2
"On 30 September, the Service completed a 12 -month project in which more than 540 explosive remnants of war were removed from an area of 59,557m2.",S/2021/62_PAR_65_SEN_3
"The Mine Action Service also completed a project to reinforce information management capabilities to map explosive remnants of war contamination in Tripoli, to facilitate clearance operations and to support the protection of civil ians.",S/2021/62_PAR_66_SEN_1
"In response to the continuing threat from explosive remnants of war, humanitarian mine action sector partners trained and accredited six additional non -technical survey teams, which will conduct essential surveys in Tripoli and facilitate prioritizat ion of future clearance.",S/2021/62_PAR_66_SEN_2
Women’s empowerment,S/2021/62_PAR_66_SEN_3
"As part of its gender inclusion strategy for the intra -Libyan dialogue, UNSMIL organized a multi -stakeholder consultation process with women’s groups in October.",S/2021/62_PAR_67_SEN_1
"Page 12 Participants included 120 women fro m cultural components, peacebuilders, human rights defenders, journalists, academics, youth and political parties.",S/2021/62_PAR_67_SEN_2
"The sessions produced recommendations, which reaffirmed UNSMIL advocacy for ensuring women’s inclusion in the UNSMIL -facilitated intra -Libyan dialogue tracks.",S/2021/62_PAR_68_SEN_1
"In accordance with these recommendations, two additional women were included in the economic dialogue.",S/2021/62_PAR_68_SEN_2
UNSMIL advocated for the inclusion of women in the 5+5 Joint Military Commission subcommittees and for a gender perspective to be considered during the monitoring and implementation of the ceasefire agreement.,S/2021/62_PAR_68_SEN_3
The recommendations were presented virtually to the Libyan Political Dialogue Forum on 26 October and 7 November.,S/2021/62_PAR_68_SEN_4
"On 15 November, the 17 women participants in the Libyan P olitical Dialogue Forum issued a statement outlining a series of principles and recommendations for improving women’s participation in the political process and governance.",S/2021/62_PAR_69_SEN_1
They called for better representation in political life and called on the State to fulfil its international commitments regarding the rights and protection of women.,S/2021/62_PAR_69_SEN_2
Their request that women should account for no less than 30 per cent of leadership positions in the reformed executive authority was echoed in the political road map agreed by the Forum.,S/2021/62_PAR_69_SEN_3
"During the reporting period, UNDP and the United Nations Entity for Gender Equality and the Empowerment of Women (UN-Women ) provided training for 20 women and youth organizations across Libya to enhance their organizational skills in order to reduce inequality and promote women empowerment.",S/2021/62_PAR_70_SEN_1
"On 11 October, five women judges were appointed to the two specialized courts established in Benghazi and Tripoli to address violence against women and children.",S/2021/62_PAR_71_SEN_1
"UNSMIL, in partnership with the United Nations Children’s Fund (UNICEF) and UN-Women , conducted a training programme on international standards for the new judges.",S/2021/62_PAR_71_SEN_2
E.,S/2021/62_PAR_71_SEN_3
"Young people, peace and security",S/2021/62_PAR_71_SEN_4
"As part of its efforts to ensure full participation of youth in the Libyan Political Dialogue Forum, UNSMIL held a virtual meeting of the Libyan youth track on 18 October, bringing together 40 male and female participants from various political, ethnic and tribal backgrounds.",S/2021/62_PAR_72_SEN_1
The participants presented their recommendations to the Forum.,S/2021/62_PAR_72_SEN_2
"The Youth against COVID -19 Fund, established by the United Nations Population Fund and a national partner organization, supported youth -led initiatives combating the C OVID -19 pandemic in Benghazi, Sabhah, Ghat and Sirte.",S/2021/62_PAR_73_SEN_1
"In this context, in October, virtual training programmes and grant -awarding schemes were initiated to empower young people, in particular young women, in crisis response.",S/2021/62_PAR_73_SEN_2
UNDP provided capacity -building training to 80 young men and women through its regional Youth Leadership Programme.,S/2021/62_PAR_74_SEN_1
The aim of the initiative is to promote their political and civic engagement and to equip them with tools to create and improve their social initiatives.,S/2021/62_PAR_74_SEN_2
F.,S/2021/62_PAR_74_SEN_3
Coor dination of international assistance,S/2021/62_PAR_74_SEN_4
"The humanitarian response continued to be coordinated by three area coordination groups and the Inter -Sector Coordination Group, under the leadership of the Humanitarian Coordinator, with support provided by the U nited Nations Office for the Coordination of Humanitarian Affairs.",S/2021/62_PAR_75_SEN_1
Page 13 79.,S/2021/62_PAR_75_SEN_2
"While the ceasefire agreement and the resumption of oil production has had a positive impact for some of the country’s most vulnerable people, in the near term, humanitarian needs are expected to persist, compounded by the ongoing impact of COVID -19.",S/2021/62_PAR_75_SEN_3
"It is estimated that, in 2021, 1.3 million people will need some form of humanitarian assistance, an increase of 40 per cent as compared with 2020.",S/2021/62_PAR_75_SEN_4
Consultations were conducted with nationa l stakeholders in all three regions on humanitarian needs and response planning for 2021.,S/2021/62_PAR_75_SEN_5
"The coordination and response to the COVID -19 pandemic continued to be led by the World Health Organization (WHO), supported by the Office for the Coord ination o f Humanitarian Affairs , inter alia, in close cooperation with the National Centre for Disease Control, the Ministry of Health of the Government of National Accord and the health authorities in the east, as well as regional health and municipal authorities.",S/2021/62_PAR_76_SEN_1
G.,S/2021/62_PAR_76_SEN_2
"Humanitarian, stabilization and development assistance",S/2021/62_PAR_76_SEN_3
"Following the suspension of hostilities in southern Tripoli in June 2020, there has been a slow decrease in the number of displaced persons, from 426,000 in June to 316,000 in December.",S/2021/62_PAR_77_SEN_1
"However, the risks posed by booby traps, including improvised explosive devices, landmines and explosive remnants of war, as well as the absence of basic services and damage to infrastructure, continued to impede the safe and dignified return of all popula tions.",S/2021/62_PAR_77_SEN_2
"The United Nations continued to support the authorities with the development of a national internal displacement strategy, including through consultations with relevant stakeholders.",S/2021/62_PAR_77_SEN_3
"The number of migrants and refugees in Libya has steadily dec reased, from 626,000 in April to 574,000 in November, in part as a result of a reduction in labour opportunities for migrant workers, increased unemployment and tightened security controls and COVID -19 mobility restrictions implemented by the authorities.",S/2021/62_PAR_78_SEN_1
"Discrimination in access to services and a lack of documentation continued to prevent migrants and refugees from meeting their basic needs, including health care, food, shelter, education and specialized protection assistance.",S/2021/62_PAR_78_SEN_2
"Confirmed COVID -19 cases have increased five -fold since September, with cases increasing daily.",S/2021/62_PAR_79_SEN_1
"As at 7 January, 102,880 cases of COVID -19 were confirmed, including 1,558 deaths.",S/2021/62_PAR_79_SEN_2
"However, owing to limited testing capacity and poor mortality surveillance, health experts suspect th e number of cases and deaths to be much higher.",S/2021/62_PAR_79_SEN_3
"While 31 laboratories are operational in the country, there are persistent and acute shortages of COVID -19 testing supplies, and response capacity is mostly concentrated in Tripoli, Misratah and Benghazi.",S/2021/62_PAR_79_SEN_4
It is expected that the three separate COVID -19 response plans in the country will soon be consolidated into one national response plan.,S/2021/62_PAR_79_SEN_5
"The UNSMIL national reconciliation project, implemented with UNDP and WHO, supported a health diplomacy initiative to strengthen the COVID -19 response and helped increase awareness of needs and response planning , as well as build longer -term mechanisms for public health cooperation throughout Libya.",S/2021/62_PAR_80_SEN_1
"On 12 September, virtual exchanges were held with over 30 health -care professionals i n Benghazi, Misratah, Sabhah and Tripoli, resulting in a COVID -19 preparedness assessment and performance cooperation goals.",S/2021/62_PAR_80_SEN_2
"On 6 November, the health diplomacy initiative senior medical advisers briefed participants of the Libyan Political Dialogue Forum virtually.",S/2021/62_PAR_80_SEN_3
"On 21 November, an online scientific information session was organized with some 200 participants to share projections for the winter season and best practices on COVID -19 response management.",S/2021/62_PAR_80_SEN_4
Page 14 85.,S/2021/62_PAR_80_SEN_5
"In view of the continued sabotage of the Great Man -Made River infrastructure, the national reconciliation project increased its engagement with the local communities to improve communication channels with the Great Man -Made River project and the General Electricity Company of Libya and begin working on mutually beneficial projects.",S/2021/62_PAR_80_SEN_6
"The continued closure of primary health -care facilities owing to shortages of health workers, power cuts and lack of personal protective equipment has impacted the COVID -19 response and access to other essential health s ervices.",S/2021/62_PAR_81_SEN_1
"This includes reproductive health care, services for children under five years of age and treatment for patients with non -communicable diseases.",S/2021/62_PAR_81_SEN_2
"On 5 November, WHO and UNICEF warned that the supply of vaccines for tuberculosis, polio and meas les would run out by the end of 2020 if immediate measures were not taken by national authorities to procure and distribute additional supplies.",S/2021/62_PAR_82_SEN_1
"In December, 804 cold boxes and vaccine carriers were dispatched through UNICEF for the Libyan National Centre for Disease C ontrol to be distributed to 278 vaccination sites.",S/2021/62_PAR_82_SEN_2
"A second vaccine stockout this year would impact children’s vaccinations schedules, increasing the risk for 250,000 children of contracting vaccine -preventable diseases.",S/2021/62_PAR_82_SEN_3
The negative soci oeconomic impact of the conflict and COVID -19 are stretching the coping capacities and resilience of people throughout Libya.,S/2021/62_PAR_83_SEN_1
Continued engagement with all authorities enabled humanitarian personnel and supplies to reach those in need.,S/2021/62_PAR_83_SEN_2
"In 2020, humanitaria n organizations reached more than 318,000 people.",S/2021/62_PAR_83_SEN_3
"This includes support for 81,000 internally displaced people, 154,000 vulnerable, conflict -affected Libyans and recent returnees and 82,000 migrants and refugees.",S/2021/62_PAR_83_SEN_4
Bureaucratic impediments and COVID -19 restriction measures hampering humanitarian access decreased during the reportin g period.,S/2021/62_PAR_84_SEN_1
"Partners reported 355 access constraints in October, representing a 36 per cent decrease as compared with September, and a further 355 cases in November.",S/2021/62_PAR_84_SEN_2
"Sig nificant progress was also made on the issuance of visas by the authorities for international humanitarian staff, following nearly eight months of visas not being issued for international staff by international NGOs working in Libya.",S/2021/62_PAR_84_SEN_3
"Despite some progress on the timely clearance of humanitarian supplies at points of entry, health partners continued to report delays for critical COVID -19 and other health supplies.",S/2021/62_PAR_84_SEN_4
Humanitarian agencies and partners continued to support the COVID -19 response in Libya.,S/2021/62_PAR_85_SEN_1
"Th is included support for increased testing capacity, contact tracing and case treatment, the provision of essential COVID -19 supplies and training and technical support for health staff.",S/2021/62_PAR_85_SEN_2
"Humanitarian agencies are working with the authorities to strengthen a nd expand disease surveillance across Libya, including the development of standard criteria for reporting confirmed COVID -19 cases and establishing early warning and event -based surveillance.",S/2021/62_PAR_85_SEN_3
Sanitation and waste management services and the provision of hy giene kits to vulnerable and low -income households continued.,S/2021/62_PAR_85_SEN_4
Humanitarian partners provided training to health and community workers and launched risk communication and community engagement campaigns.,S/2021/62_PAR_85_SEN_5
"The United Nations continued to support increased COVID -19 awareness campaigns and risk communication activities by disseminating more than 300,000 items of information materials and conducting campaigns on social and mass media.",S/2021/62_PAR_86_SEN_1
"COVID -19 risk communication activities also targeted vulnerable groups and health staff in at -risk locations, including displaced persons in shelters, migrants and refugees in official detention centres, health facilities and points of entry and disembarkation.",S/2021/62_PAR_86_SEN_2
"Between August and November, close to 1.4 million people were informe d about prevention and access to services for COVID -19 through messaging.",S/2021/62_PAR_86_SEN_3
Page 15 92.,S/2021/62_PAR_86_SEN_4
The UNDP resilience and recovery project provided support to 52 municipalities across Libya to improve access to quality basic and social services for the most vulnerable groups .,S/2021/62_PAR_86_SEN_5
"The UNDP Stabilization Facility for Libya completed 292 projects across the country, with an additional 42 projects to support the rehabilitation of schools and medical facilities and improve sanitation services.",S/2021/62_PAR_86_SEN_6
IV .,S/2021/62_PAR_86_SEN_7
Deployment of the United Nations Support Mission in Libya and security arrangements,S/2021/62_PAR_86_SEN_8
"During the reporting period, the United Nations maintained an international civilian staff presence in Libya of 60 to 90 international staff on a rotational basis, with most international staff in T ripoli and a small presence in the Benghazi hub.",S/2021/62_PAR_87_SEN_1
"Staff presence was monitored closely and adjusted in line with the prevailing security situation, requirements for humanitarian assistance and changing requirements to protect staff from contracting or potentially spreading COVID -19.",S/2021/62_PAR_88_SEN_1
"All international staff in Tripoli continued to be accommodated at the Oea compound, which continues to be protected by the United Nations Guard Unit.",S/2021/62_PAR_88_SEN_2
National staff were instructed to report to work in the compound only whe n their presence was required and to work remotely at other times.,S/2021/62_PAR_88_SEN_3
UNSMIL continued to implement a comprehensive set of measures to ensure the best possible protection of United Nations personnel against the COVID -19 pandemic.,S/2021/62_PAR_89_SEN_1
"The measures were regula rly reviewed and adjusted in accordance with advice by WHO and UNSMIL medical staff, and with measures put in place by the Libyan and Tunisian authorities.",S/2021/62_PAR_89_SEN_2
"Owing to host government restrictions, the United Nations’ ability to conduct flights between the tw o countries remained limited.",S/2021/62_PAR_89_SEN_3
Strict COVID -19 preventive measures are applied on all flights.,S/2021/62_PAR_89_SEN_4
The rotation of the United Nations Guard Unit was conducted with two flights on 31 October and 20 November from Kathmandu to Tripoli.,S/2021/62_PAR_90_SEN_1
"Road movements in Tripo li were conducted in strict compliance with security risk management measures and reduced to those absolutely necessary, in view of the COVID -19 pandemic.",S/2021/62_PAR_90_SEN_2
V .,S/2021/62_PAR_90_SEN_3
Observations and recommendations,S/2021/62_PAR_90_SEN_4
"Sustained international engagement acro ss the UNSMIL -facilitated intra -Libyan dialogues has generated considerable impetus, demonstrated by tangible progress on the political, security, economic and international humanitarian law and human rights tracks, moving Libya forward on the road to peace, stab ility and development.",S/2021/62_PAR_91_SEN_1
