doc_text,sentence_id
"On 29 April, following consultations between local community representatives and the Chief of General Staff of the Libyan Army, Mohammed al -Haddad, a newly established “committee of 15”, composed of elders, notables and security act ors, developed a security plan for the city of Zawiyah, which included the reopening of the Zawiyah Security Directorate and the deployment of a joint force at strategic locations along the western coastal road and in the city itself.",S/2023/589_PAR_27_SEN_1
"Between 25 May a nd mid -July, the Government of National Unity carried out an estimated 25 to 30 air raids, using uncrewed aerial vehicles, in Zawiyah and the neighbouring towns of Zuwarah, Ujaylat and Surman, reportedly targeting criminal activities such as illicit traffi cking in drugs, arms, fuel and humans.",S/2023/589_PAR_28_SEN_1
"On 29 May, the Ministry of Defence reported that the air raids had resulted in the destruction of seven boats intended to be used for trafficking in persons, six warehouses for trafficking in drugs, weapons and equipm ent used by “criminal gangs” and nine tanks for fuel smuggling.",S/2023/589_PAR_28_SEN_2
"As a result of the air raids, seven civilians, including a child, were reportedly injured and a medical clinic destroyed.",S/2023/589_PAR_28_SEN_3
"Some eastern leaders described the raids as politically motivated, arg uing that they only targeted groups that were not aligned with the Prime Minister, Mr. Abdulhamid Al Dabiba.",S/2023/589_PAR_28_SEN_4
"A fragile calm prevailed in Tripoli, occasionally interrupted by clashes between major armed groups.",S/2023/589_PAR_29_SEN_1
"On 28 May, clashes erupted in densely popu lated areas following the alleged arrest of a member of the 444th Brigade by the Deterrence Apparatus for Combating Organized Crime and Terrorism.",S/2023/589_PAR_29_SEN_2
"On 6 June, the Prime Minister issued a decree merging several Tripoli -based armed groups under his command an d control as the National Agency for Support Forces.",S/2023/589_PAR_29_SEN_3
"The Presidential Council, along with other institutions and stakeholders, expressed opposition to the decree.",S/2023/589_PAR_29_SEN_4
E.,S/2023/589_PAR_29_SEN_5
Situation in the eastern region,S/2023/589_PAR_29_SEN_6
"From 31 May to 3 June, the Libyan National Army launched a joint security operation targeting human trafficking and drug smuggling networks in the wider Page 6 Tubruq area, near the border between Libya and Egypt.",S/2023/589_PAR_30_SEN_1
"Operations were also targeted at irregular migran ts, including those in transit or residing in Libya.",S/2023/589_PAR_30_SEN_2
"The International Organization for Migration (IOM) reported that 14,500 migrants, most of them Egyptians, had been forcibly expelled to Egypt and around 400 non -Egyptian nationals had been taken to deten tion centres in eastern Libya.",S/2023/589_PAR_30_SEN_3
F.,S/2023/589_PAR_30_SEN_4
Situation in the southern region,S/2023/589_PAR_30_SEN_5
"The outbreak of hostilities in the Sudan raised concern about a possible spillover into Libya, including a possible influx of refugees and cross -border movements of Sudanese armed elements.",S/2023/589_PAR_31_SEN_1
"In response, the Libyan National Army General Command closed the country’s borders with Chad and the Sudan and ordered the deployment of reinforcements in the south -east and south -west border areas.",S/2023/589_PAR_31_SEN_2
"On 27 April, in anticipation of a potential in flux of refugees, an emergency room was established in Kufrah municipality, bringing together security actors to support the coordination of aid.",S/2023/589_PAR_31_SEN_3
Allegations that the Libyan National Army was reportedly providing support to the Rapid Support Forces were de nied by both parties.,S/2023/589_PAR_31_SEN_4
"The Libyan National Army continued its efforts to assert control over vital infrastructure, such as oil facilities, water pumps and basins of the Great Man -Made River, and gold and mineral mining areas in the central and southern regions.",S/2023/589_PAR_32_SEN_1
"On 7 May, a Libyan National Army delegation led by Saddam Haftar, the son of General Haftar, conducted a tour of the southern region, which was described by the media office of the Libyan National Army General Command as an inspection visit to identify challenges and ways forward to secure the oilfields.",S/2023/589_PAR_32_SEN_2
G.,S/2023/589_PAR_32_SEN_3
Violent extremist organizations,S/2023/589_PAR_32_SEN_4
"The porosity of the southern borders, combined with the inability of the authorities to effectively control remote areas of the southern region, continue to make the country a haven for criminal networks and violent extremist organizations.",S/2023/589_PAR_33_SEN_1
Concerns remain that the crisis in the Sudan and instability in the Lake Chad basin and the Sahel may further enable the operations of those groups in Libya.,S/2023/589_PAR_33_SEN_2
H.,S/2023/589_PAR_33_SEN_3
Economic situation,S/2023/589_PAR_33_SEN_4
Oil production in Libya was sustained at around 1.2 million barrels per day.,S/2023/589_PAR_34_SEN_1
"The National Oil Corporation engaged with international investors with the objective of securing investments in production capacity that would enable an inc rease in oil production to 2 million barrels per day and raise gas production from 2.6 billion to 4 billion cubic feet per day over the next three to five years, in accordance with the Corporation’s operational and development plan for the period 2023 to 2027 and as approved by the Supreme Energy Council of Libya on 29 March.",S/2023/589_PAR_34_SEN_2
"Growth in real gross domestic product is projected to be 17.9 per cent in 2023, owing mainly to a potential increase in oil production to 1.4 million barrels per day and growth in the non -hydrocarbon sector.",S/2023/589_PAR_35_SEN_1
"Unemployment in Libya remains at 20 per cent, with youth unemployment at 50 per cent.",S/2023/589_PAR_35_SEN_2
"On 24 May, the Executive Board of the International Monetary Fund concluded its Article IV consultation with Libya.",S/2023/589_PAR_36_SEN_1
"In a press release, the Board stated that the economy of Libya was heavily reliant on oil and gas production.",S/2023/589_PAR_36_SEN_2
"The Board encouraged the autho rities of Libya to enhance transparency, strengthen institutions Page 7 and address corruption in order to promote stronger, more inclusive private sector -led growth and diversification away from hydrocarbons.",S/2023/589_PAR_36_SEN_3
"On 15 June, the Speaker of the House of Represen tatives announced the establishment of a committee tasked with developing a new concept note on restructuring the State’s general budget, including with regard to the fair distribution of revenues from the sale of natural resources.",S/2023/589_PAR_37_SEN_1
The committee is to be chaired by the Head of the National Oil Corporation.,S/2023/589_PAR_37_SEN_2
"In response, the Prime Minister issued a decree establishing an oversight committee under the Government of National Unity.",S/2023/589_PAR_37_SEN_3
Other activities of the United Nations Support Mission in Libya A.,S/2023/589_PAR_37_SEN_4
Electoral support,S/2023/589_PAR_37_SEN_5
UNSMIL and the United Nations Development Programme (UNDP) continued to support the High National Elections Commission in enhancing its technical readiness to organize elections once an agreement on the legal framework has been reach ed.,S/2023/589_PAR_38_SEN_1
The Commission is estimated to require approximately 170 days following the finalization of the electoral laws to organize the first round of elections.,S/2023/589_PAR_38_SEN_2
"On 2 May, the Board of Commissioners of the High National Elections Commission sent a letter to the Government of National Unity requesting 170 million Libyan dinars (equivalent to $35 million) for the upcoming electoral process.",S/2023/589_PAR_39_SEN_1
The amount included 145 million Libyan dinars ($30 million) for the operational budget to hold two rounds of parliamentar y and presidential elections simultaneously and 25 million Libyan dinars ($5 million) for the procurement of electronic voter identification devices.,S/2023/589_PAR_39_SEN_2
"On 14 May, the President of the Presidential Council, the Prime Minister and the Minister of Finance visit ed the Commission to discuss electoral preparations and expressed their support for the proposed budget.",S/2023/589_PAR_39_SEN_3
"On 21 and 22 May, the High National Elections Commission organized a regional conference, in Tripoli, on enhancing the participation of women in el ections.",S/2023/589_PAR_40_SEN_1
"The Minister of Women’s Affairs, Houria al -Turman, took part in the event, alongside representatives of the national and regional electoral authorities of 12 Arab countries.",S/2023/589_PAR_40_SEN_2
"The conference was part of the ongoing support provided to the Commission by UNSMIL, UNDP and the United Nations Entity for Gender Equality and the Empowerment of Women (UN -Women) to increase the participation of women in all phases of the electoral cycle.",S/2023/589_PAR_40_SEN_3
"During the conference, the Commission shared preliminary results from th e “eMonitor plus” platform, through which online violence against women in the context of elections is monitored.",S/2023/589_PAR_40_SEN_4
"Participants discussed the potential adoption of an electoral system based on proportional representation, with closed lists and a quota of se ats for women in the parliament.",S/2023/589_PAR_40_SEN_5
"They also highlighted the need to advocate with national authorities for the adoption of gender -sensitive legislation, the inclusion of women in legislative drafting committees and the establishment of a women’s support uni t in all electoral management bodies.",S/2023/589_PAR_40_SEN_6
"Following a request from the Prime Minister for additional United Nations technical assistance on elections, the Department of Political and Peacebuilding Affairs, in cooperation with UNDP, deployed an electoral te chnical mission to Libya, from 1 to 8 June.",S/2023/589_PAR_41_SEN_1
"With regard to local elections, UNDP provided technical assistance to the Central Committee for Local Elections on drafting training manuals, guidelines and operational plans and developed a logistics and di stribution plan for electoral materials.",S/2023/589_PAR_42_SEN_1
"In addition, UNDP supported engagement between the Central Committee Page 8 and civil society organizations and other electoral stakeholders by raising public awareness through videos and media campaigns.",S/2023/589_PAR_42_SEN_2
"On 27 May, local elections were held in Zuwarah and Daraj municipalities.",S/2023/589_PAR_42_SEN_3
"On 30 May, the House of Representatives issued a statement announcing its intention to amend relevant laws to transfer the duties associated with implementing local elections from the Central Com mittee for Local Elections to the High National Elections Commission.",S/2023/589_PAR_43_SEN_1
The Commission is redefining its structure so as to be able to respond to the new demand.,S/2023/589_PAR_43_SEN_2
"In the meantime, local elections in the west of the country continued to be implemented by the C entral Committee and by a parallel authority in eastern Libya.",S/2023/589_PAR_43_SEN_3
B.,S/2023/589_PAR_43_SEN_4
"Human rights, transitional justice and the rule of law",S/2023/589_PAR_43_SEN_5
Restrictions on civic space and excessive control by authorities and security actors over civil society actors increased dur ing the reporting period.,S/2023/589_PAR_44_SEN_1
"On 22 May, the Government of National Unity issued a decision establishing a committee to regulate civil society organizations on the basis of Law No.",S/2023/589_PAR_44_SEN_2
"19 of 2001, a restrictive law providing for State control over civil society ac tivities.",S/2023/589_PAR_44_SEN_3
"On 25 May, the General Authority of Endowments and Islamic Affairs issued a decree establishing a programme entitled “Guardians of Virtue” and creating national and local commissions to monitor and track what were described as “destructive belief s and intellectual and moral deviations” and to “rehabilitate and reintegrate victims of moral deviations”.",S/2023/589_PAR_44_SEN_4
"In late April, the Internal Security Agency introduced a gender - discriminatory restrictive procedure pursuant to which Libyan women travelling alone and departing from airports in the western region were required to provide information on the reasons why they were travelling abroad without a male companion, which could have the effect of restricting their right to freedom of movement.",S/2023/589_PAR_44_SEN_5
Rule of law,S/2023/589_PAR_44_SEN_6
"On 27 April, five new judges of the Supreme Court, who had been appointed by the House of Representatives, took their oath of office before the Speaker of the House, in accordance with House of Representatives resolution No.",S/2023/589_PAR_45_SEN_1
"5 of 2023, in which the authority of the House to appoint new justices was stipulated.",S/2023/589_PAR_45_SEN_2
"On 3 May, the General Assembly of the Supreme Court, based in Tripoli, refused to accept the new judges, asserting that they should first have been nominated by the General Assembly of the Supreme Court, in accordance with Law No.",S/2023/589_PAR_45_SEN_3
"6 of 1982 and the executive regulations of 2004, by which the General Assembly of the Supreme Court has the authority to nominate new justices before their appointment by the House.",S/2023/589_PAR_45_SEN_4
"A few weeks later, the Pr esidency of the Supreme Court accepted the five judges and allowed them to sit on civil panels.",S/2023/589_PAR_45_SEN_5
"On 22 April, the Court of Justice of the European Union ruled that current European Union sanctions, including a visa ban and the freezing of assets, agains t the daughter of the late former leader of Libya, Muammar Gaddafi, Aisha Muammar Gaddafi, must be lifted.",S/2023/589_PAR_46_SEN_1
UNSMIL continued to provide capacity -building assistance on the rule of law to Libyan institutions.,S/2023/589_PAR_47_SEN_1
"From 2 to 8 May, UNSMIL, in cooperation with UNDP, UN-Women and the Team of Experts on the Rule of Law and Sexual Violence in Conflict, provided training, in Benghazi, for 48 female lawyers from Benghazi, Bayda’ and Ajdabiya.",S/2023/589_PAR_47_SEN_2
"The training was focused on international standards on human rights and cri minal justice and the Libyan code of ethics for lawyers, as well as on combating violence against women and conflict -related sexual violence.",S/2023/589_PAR_47_SEN_3
"Separately, Page 9 the United Nations Children’s Fund (UNICEF), UNDP and the United Nations Office on Drugs and Crime pro vided support to strengthen the capacity of the family and child protection units of the police.",S/2023/589_PAR_47_SEN_4
"Unlawful deprivation of liberty, detention and torture",S/2023/589_PAR_47_SEN_5
UNSMIL continued to receive reports of enforced disappearances and the prolonged arbitrary detention of Libyans and non -Libyans in prisons and detention centres across the country.,S/2023/589_PAR_48_SEN_1
"The Mission also continued to receive reports of men and women detainees in all parts of Libya being subjected to ill -treatment, sexual violence, torture or sexual exploitation in exchange for water, food or other essential items.",S/2023/589_PAR_48_SEN_2
"At least 25 foreign women and their 38 children remain in prolonged detention in Judaydah prison, in Tripoli, and Kuwayfiyah prison, in Benghazi, owing to their alleged links to Da’esh.",S/2023/589_PAR_49_SEN_1
"On 30 May, UNSMIL met with five of the detainees in Judaydah prison and engaged with the authorities to address the situation of the women and children in detention, including to ensure due process, access to justice, possible relocation and educa tion for the children.",S/2023/589_PAR_49_SEN_2
"The United Nations continued to seek increased access to the facilities to provide essential life -saving services and facilitate voluntary repatriation or other solutions, in accordance with the principle of non-refoulement.",S/2023/589_PAR_49_SEN_3
"During the reporting period, the Tripoli - and Benghazi -based Internal Security Agencies arbitrarily detained several individuals, most of whose whereabouts remain unknown.",S/2023/589_PAR_50_SEN_1
"The Internal Security Agencies’ practice of extracting forced confessions from individu als in their custody and publishing them on social media continued, in violation of the country’s laws and international human rights law.",S/2023/589_PAR_50_SEN_2
"According to official statistics provided by the Ministry of Justice, on 5 May, 19,103 persons, including 216 wo men, were deprived of their liberty in 28 official prisons under the Ministry’s authority.",S/2023/589_PAR_51_SEN_1
An estimated 29 per cent of those persons were in pretrial detention and many remained in prolonged detention with limited or delayed access to justice.,S/2023/589_PAR_51_SEN_2
"Thousands of others, including Libyans, migrants and asylum -seekers, including women and children, remain in unofficial places of detention under the control of armed groups.",S/2023/589_PAR_51_SEN_3
Migrants and refugees,S/2023/589_PAR_51_SEN_4
"The humanitarian situation, human rights and protection of migrants and refugees remained of serious concern.",S/2023/589_PAR_52_SEN_1
"On 1 May, the Directorate for Combating Illegal Migration announced a countrywide campaign to arrest migrants.",S/2023/589_PAR_52_SEN_2
"Under the campaign, the homes and w orkplaces of migrants were raided and thousands of migrants, including pregnant women and children, were arrested and arbitrarily detained.",S/2023/589_PAR_52_SEN_3
"Hundreds of people, including women and children, were forcibly deported across the borders into Chad, Egypt, the Ni ger, the Sudan and Tunisia without legal review.",S/2023/589_PAR_52_SEN_4
"On 29 May, the Libyan Special Naval Forces, under the control of the Libyan National Army, reportedly intercepted a large fishing boat, off the coast of Tubruq in eastern Libya, that was suspected of in volvement in human trafficking.",S/2023/589_PAR_53_SEN_1
"On 14 June, a fishing boat carrying several hundred migrants from Tubruq to Italy capsized and sank off the coast of Greece.",S/2023/589_PAR_53_SEN_2
"The Greek authorities rescued an estimated 100 people, while hundreds of others remain missing.",S/2023/589_PAR_53_SEN_3
"The survivors, mainly young men, reported that women and children had been in the hull of the boat.",S/2023/589_PAR_53_SEN_4
Libya continues to be both a country of destination and transit for migrants and asylum -seekers.,S/2023/589_PAR_54_SEN_1
"According to IOM, the number of migrants in Libya stood at 706,062 Page 10 in February 2023, up from 635,051 in January 2022.",S/2023/589_PAR_54_SEN_2
"Meanwhile, the number of migrants attempting to cross the Mediterranean Sea from Libya increased during the reporting period.",S/2023/589_PAR_54_SEN_3
"As at 1 July 2023, 8,496 individuals, including women and children, have been intercepted and returned to Libya since the start of the year.",S/2023/589_PAR_54_SEN_4
An additional 780 people were reported dead and 944 missing between 1 January and 1 July.,S/2023/589_PAR_54_SEN_5
"Migrants and refugees who disembarked at Libyan ports to which United Nations humanitarian agen cies have access received basic emergency relief items, as well as health -care services and protection.",S/2023/589_PAR_54_SEN_6
"Most of the migrants were subsequently transferred to detention centres, to which the United Nations has limited access.",S/2023/589_PAR_54_SEN_7
"The United Nations continue d to observe the prolonged detention of migrant children with no judicial process, in violation of the country’s obligations under international human rights law.",S/2023/589_PAR_55_SEN_1
"Detained migrant children were released only if they had guaranteed durable solutions in plac e, namely voluntary humanitarian return facilitated by IOM or resettlement or evacuation to a third country facilitated by the Office of the United Nations High Commissioner for Refugees.",S/2023/589_PAR_55_SEN_2
"UNSMIL verified 24 cases of abduction of children from the Sudan, wh ere they had been registered as asylum -seekers and subsequently trafficked to Libya.",S/2023/589_PAR_55_SEN_3
"Monitoring by UNSMIL indicated that these children were subjected to further human rights violations in Libya, including forced labour in military camps without payment.",S/2023/589_PAR_55_SEN_4
U NICEF provided technical support and training for 10 social workers assigned by the Ministry of Social Affairs to monitor and follow up on the situation and provided life -saving services for children in detention centres.,S/2023/589_PAR_55_SEN_5
"In July, following clashes be tween residents and migrants in Sfax, Tunisia, hundreds of migrants, including children and expectant mothers, were forcibly transported to a deserted area on the border between Tunisia and Libya and abandoned without food or water.",S/2023/589_PAR_56_SEN_1
"By the end of July, Uni ted Nations funds, programmes and specialized agencies in Libya and Tunisia had scaled up their assistance to support refugees and asylum -seekers in need.",S/2023/589_PAR_56_SEN_2
Groups in vulnerable situations,S/2023/589_PAR_56_SEN_3
"UNSMIL continued to follow incidents of forced evictions a nd illegal demolitions in the historic city centre of Benghazi, including in central neighbourhoods and the Hesperides archaeological site.",S/2023/589_PAR_57_SEN_1
At least 100 individuals were forcibly evicted from their homes with limited or no compensation.,S/2023/589_PAR_57_SEN_2
"On 8 May, residents of the historic city centre demonstrated against the demolitions and forced evictions.",S/2023/589_PAR_57_SEN_3
"At least three individuals were arrested by the Tareq Bin Ziyad Brigade and released shortly afterwards, while several others were reportedly threatened.",S/2023/589_PAR_57_SEN_4
"Separately, in Tripoli, UNSMIL received reports of possible evictions in Abu Salim municipality of 350 internally displaced families from the east and followed up with the relevant authorities to find durable solutions for them.",S/2023/589_PAR_57_SEN_5
"On 4 May, four Tunisian women detaine es, allegedly linked to Da’esh, were repatriated with their five children from Judaydah prison in Tripoli to Tunisia.",S/2023/589_PAR_58_SEN_1
The women had been acquitted by a Mitiga court in March 2023.,S/2023/589_PAR_58_SEN_2
Nine others had been convicted and sentenced to 12 years in prison.,S/2023/589_PAR_58_SEN_3
Seven of those sentenced were held in prison with their children aged between 7 and 16 years.,S/2023/589_PAR_58_SEN_4
Transitional justice and rights -based reconciliation,S/2023/589_PAR_58_SEN_5
"On 11 May, the Prosecutor of the International Criminal Court gave a briefing to the Security Council on t he Court’s progress in prosecuting alleged crimes against humanity committed in Libya.",S/2023/589_PAR_59_SEN_1
"The Prosecutor stated that four warrants had been issued by judges of the Court, while applications had been submitted for two additional warrants.",S/2023/589_PAR_59_SEN_2
Page 11 60.,S/2023/589_PAR_59_SEN_3
"From 12 to 15 Ma y, UNSMIL held consultations with more than 70 victims of human rights violations, in Benghazi.",S/2023/589_PAR_59_SEN_4
"Participants included women, young people and internally displaced persons, as well as human rights activists and legal actors.",S/2023/589_PAR_59_SEN_5
"The consultations were conducted as part of Human Rights Council -mandated activities aimed at better understanding the needs and demands of victims, informing them of ongoing transitional justice efforts, enabling them to conduct advocacy concerning their rights and raising awareness of the importance of victims’ participation and representation in future transitional justice mechanisms (see Human Rights Council resolution ).",S/2023/589_PAR_59_SEN_6
"Separately, from 13 to 15 June, UNSMIL organized a work shop on international best practices for investigating grave human rights violations and crimes against humanity, with a focus on Tarhunah.",S/2023/589_PAR_59_SEN_7
The workshop brought together judicial forensics and criminal justice actors working to investigate grave human righ ts violations that had occurred in the town.,S/2023/589_PAR_59_SEN_8
Human rights due diligence policy,S/2023/589_PAR_59_SEN_9
"On 12 April, UNSMIL organized a meeting of the human rights due diligence policy task force to update participating United Nations country team members on the human r ights situation in Libya.",S/2023/589_PAR_60_SEN_1
"Participants endorsed the updated standard operating procedures, a set of forms for the vetting, screening and reporting of incidents and a set of key messages on United Nations human rights due diligence policy.",S/2023/589_PAR_60_SEN_2
Security sector 1.,S/2023/589_PAR_60_SEN_3
Support for Libyan planning for interim security arrangements and the unification of security forces,S/2023/589_PAR_60_SEN_4
"UNSMIL continued to advance discussions on the pre -disarmament, demobilization and reintegration process with the 5+5 Joint Mi litary Commission, civil society organizations and the international community.",S/2023/589_PAR_61_SEN_1
"On 16 May, UNSMIL organized a workshop on the role of civil society in supporting national disarmament, demobilization and reintegration institutions.",S/2023/589_PAR_62_SEN_1
