doc_text,sentence_id
"The present report, submitted pursuant to Security Council resolutions 2486 (2019) and 2510 (2020) , covers political, security -related and economi c developments in Libya, provides an overview of the human rights and humanitarian situation and includes an outline of the activities of the United Nations Support Mission in Libya (UNSMIL) since the issuance of my previous report on 15 January 2020 ( S/2020/41 ).",S/2020/360_PAR_1_SEN_1
"Political, security -related and economic developments",S/2020/360_PAR_1_SEN_2
"Following a relative reduction in fighting in the immediate aftermath of the truce of 12 January called for by the Presidents of the R ussian Federation and Turkey and accepted by the Government of National Accord and the Libyan National Army, fighting gradually resumed.",S/2020/360_PAR_2_SEN_1
Both parties redeployed forces along the front lines in the Tripoli area.,S/2020/360_PAR_2_SEN_2
"As at 21 April, more than 850 reported breac hes of the ceasefire had been recorded by UNSMIL, including an unprecedented increase in indirect fire observed in urban areas, resulting in civilian casualties, damage to civilian infrastructure and disruption of commercial air operations.",S/2020/360_PAR_2_SEN_3
"At other flashp oints in western Libya, tensions also remained high.",S/2020/360_PAR_2_SEN_4
"On 26 January, the Libyan National Army launched an offensive against the forces of the Government of National Accord in the Abu Qurayn area, south of Misratah, prompting heavy clashes and casualties on both sides.",S/2020/360_PAR_2_SEN_5
"At the end of March, heavy artillery fire and rocket attacks were continued by both sides in parts of southern Tripoli and in the central and western regions.",S/2020/360_PAR_2_SEN_6
Locations along the western coastal road towards the border with Tunisia were seized by the forces of the Government of National Accord in mid -April.,S/2020/360_PAR_2_SEN_7
"On 18 April, those forces launched a coordinated attack against the city of Tarhunah.",S/2020/360_PAR_2_SEN_8
"Reports continued of foreign mercenaries providing the Government of National Accord and the Libyan N ational Army with enhanced combat capabilities, amid persistent reports of military equipment and arms being supplied to both sides in violation of the United Nations -imposed arms embargo.",S/2020/360_PAR_3_SEN_1
Those developments undermined United Nations -led dialogue initiativ es and added to more human suffering.,S/2020/360_PAR_3_SEN_2
"From 1 January to 31 March, there were at least 131 civilian casualties in Libya, including at least 64 persons who were killed.",S/2020/360_PAR_3_SEN_3
"Since April 2019, more than Page 2 200,000 persons have been forced to leave their homes in and around Tripoli owing to armed conflict.",S/2020/360_PAR_3_SEN_4
"To prevent the spread of coronavirus disease (COVID -19), the national authorities and the unrecognized “interim government” based in eastern Libya introduced preventive measures, including the closure of all air, land and sea borders; restrictions on movement between municipalities and regions; curfews; lockdowns; the suspension of Friday prayers and gatherings; the closure of schools and non-essential shops; and restrictions on public transportation.",S/2020/360_PAR_4_SEN_1
"On 14 March , the Prime Minister, Faiez Mustafa Serraj, announced a state of emergency in Libya and allocated 575 million Libyan dinars (about $406 million) to COVID -19 preparedness and response.",S/2020/360_PAR_4_SEN_2
Separate committees were established in the east and the west to address the impact of the disease.,S/2020/360_PAR_4_SEN_3
"Although prevention and preparedness measures taken with regard to the COVID -19 pandemic were introduced by authorities with the support of the United Nations, Libya remained at an extremely high risk.",S/2020/360_PAR_5_SEN_1
"The situation was comp ounded by increasing levels of fighting and insecurity, political fragmentation and a weak and overstretched health system.",S/2020/360_PAR_5_SEN_2
"The pandemic led to a loss of income for segments of society, food shortages and an increase in the price of basic commodities.",S/2020/360_PAR_5_SEN_3
"In a ddition, measures to restrict the spread of COVID -19 hampered access to humanitarian aid and the movement of medical and humanitarian personnel.",S/2020/360_PAR_5_SEN_4
The ongoing conflict and the current pandemic further weakened the already tenuous economic situation in Lib ya.,S/2020/360_PAR_6_SEN_1
The declaration of force majeure by the National Oil Corporation on 18 January as a result of a closure of oil ports in areas under the control of the Libyan National Army reduced oil production to less than a tenth of its prior output.,S/2020/360_PAR_6_SEN_2
"The Libyan Nati onal Army -supported blockage of oil exports prompted the Government of National Accord to take austerity measures to reduce spending, including payroll reductions.",S/2020/360_PAR_6_SEN_3
The austerity measures will further exhaust coping mechanisms at a time when the population is facing tremendous additional economic pressures owing to COVID -19.,S/2020/360_PAR_6_SEN_4
"On 18 and 21 March, respectively, the Government of National Accord and the Libyan National Army responded positively to international calls for an immediate humanitarian truce and a halt to the continuing transfer of all military equipment and personnel to Libya in order to allow local authorities to respond to the pandemic.",S/2020/360_PAR_7_SEN_1
"On 21 March, I welcomed the positive responses received from both sides.",S/2020/360_PAR_7_SEN_2
"On 23 March, I called for an immedia te global ceasefire in all corners of the world in order for all efforts to be focused on addressing the pandemic and saving lives.",S/2020/360_PAR_7_SEN_3
Respect for the humanitarian truce was short -lived.,S/2020/360_PAR_8_SEN_1
"Armed confrontation intensified in southern Tripoli and spread to ar eas around the airbase in Watiyah, in the country’s north -west section.",S/2020/360_PAR_8_SEN_2
"On 23 March, the Government of National Accord launched Operation Peace Storm, which it said was a response to the increased attacks by the Libyan National Army on civilian neighbourh oods in Tripoli.",S/2020/360_PAR_8_SEN_3
The military escalation complicated efforts by civilian authorities and the population towards putting preventive measures in place to address the pandemic.,S/2020/360_PAR_8_SEN_4
"Violence escalated unabated, even after the Security Council issued elements for the press on 26 March, in which concern was expressed about the significant escalation of hostilities on the ground and the possible impact of the pandemic in Libya.",S/2020/360_PAR_9_SEN_1
"The parties were called upon to de -escalate the fighting, cease hostilities and ensure unhindered access to humanitarian aid throughout the country.",S/2020/360_PAR_9_SEN_2
The Council also reaffirmed the central role of the United Nations in facilitating a Libyan -led and Libyan -owned inclusive political process.,S/2020/360_PAR_9_SEN_3
Page 3 10.,S/2020/360_PAR_9_SEN_4
"On 23 April, the Speaker of the House of Repres entatives, Agila Saleh, announced a new political initiative, calling for the social and political constituencies in eastern, western and southern Libya to each elect a representative to a three - member Presidency Council under the supervision of the United Nations.",S/2020/360_PAR_9_SEN_5
"On the same day, the Commander of the Libyan National Army, General Khalifa Haftar, reiterated that the Libyan Political Agreement and the current Presidency Council were no longer valid, requesting Libyans to empower an institution that was able to lead the country during the transitional period on the basis of a new constitutional declaration.",S/2020/360_PAR_9_SEN_6
"On 27 April, General Haftar announced that he had accepted the mandate provided by the Libyan people to the Libyan National Army to lead the country.",S/2020/360_PAR_9_SEN_7
"On 2 9 April, the Libyan National Army announced a halt to all military operations during the holy month of Ramadan.",S/2020/360_PAR_9_SEN_8
"Following the resignation of my Special Representative for Libya and Head of UNSMIL for health -related reasons, on 11 March, I designate d his Deputy, Stephanie Turco Williams, my Acting Special Representative and Head of UNSMIL.",S/2020/360_PAR_10_SEN_1
The process of appointing a new Special Representative is continuing.,S/2020/360_PAR_10_SEN_2
Implementation of the three -step initiative and the political process,S/2020/360_PAR_10_SEN_3
International efforts to de -escalate the conflict and pave the way for a political solution to the Libyan crisis continued.,S/2020/360_PAR_11_SEN_1
The United Nations and the Government of Germany organized the Berlin Conference on Libya on 19 January.,S/2020/360_PAR_11_SEN_2
"Other participants included Algeria, China, the Congo, Egypt, France, Italy, the Russian Federation, Turkey, the United Arab Emirates, the United Kingdom of Great Britain and Northern Ireland and the United States of America, as well as senior officials from the African Union, the E uropean Union and the League of Arab States.",S/2020/360_PAR_11_SEN_3
"All participants signed the press release, in which they committed themselves to assisting in ending the fighting, refraining from interfering in the conflict and implementing the arms embargo established in Sec urity Council resolution 1970 (2011) .",S/2020/360_PAR_11_SEN_4
Participants called for the cessation of all hostilities and the start of ceasefire negotiations and urged the Libyan parties to resume the political process.,S/2020/360_PAR_11_SEN_5
"In t he press release, all parties were urged to respect international humanitarian law and human rights law fully, and support for security and economic reform was highlighted.",S/2020/360_PAR_11_SEN_6
"An international follow -up committee to the Berlin Conference, consisting of all countries and international organizations that had participated in the Berlin Conference, was established and tasked with assisting in the operationalization of the conclusions of the conference, under the auspices of the United Nations.",S/2020/360_PAR_12_SEN_1
"On the margins o f the conference, Mr. Serraj and General Haftar appointed their respective representatives to the UNSMIL -facilitated 5+5 Joint Military Commission.",S/2020/360_PAR_12_SEN_2
"On 13 February, the Security Council adopted resolution 2510 (2020) , endorsing the conclusions of the Berlin Conference on Libya and expressing unequivocal support for the intra -Libyan dialogue.",S/2020/360_PAR_13_SEN_1
"On 6 January, UNSMIL facilitated the first meeting of the economic track of the intra -Libyan dialogue in Tunis, with 19 participants.",S/2020/360_PAR_14_SEN_1
"At the second meeting, held in Cairo on 9 and 10 February and involving 28 representatives of Libyan economic institutions and economic experts, participants agreed to a draft terms of reference for a Libyan expert economic commission and the creation of three working groups to refine specific policy recommendations.",S/2020/360_PAR_14_SEN_2
"All of the working groups have since met to develop policy recommendations on issues of immediate priority, including revenue distribution, the banking and private sectors and development and reconstruction.",S/2020/360_PAR_14_SEN_3
"The third meeting of the economic track of the dialogue, scheduled for 15 March, was postponed owing to COVID -19.",S/2020/360_PAR_14_SEN_4
"The working groups continued to meet in Libya, with remote participation from other l ocations, to develop the policy recommendations.",S/2020/360_PAR_14_SEN_5
Page 4 16.,S/2020/360_PAR_14_SEN_6
"On 3 February, the Joint Military Commission held its first session in Geneva under the auspices of UNSMIL with the aim of reaching a lasting ceasefire and restoring security to civilian areas.",S/2020/360_PAR_14_SEN_7
"The Gove rnment of National Accord and Libyan National Army delegations, each composed of five military and security officers, discussed provisional security measures and ceasefire arrangements.",S/2020/360_PAR_14_SEN_8
"At the end of the second round of talks, held on 23 February, UNSMIL prepared a draft ceasefire agreement with provisions for the safe return of civilians to their areas of residence.",S/2020/360_PAR_14_SEN_9
It was agreed that the two delegations would present the draft agreement to their respective leaderships for further consultations and that t he Joint Military Commission would reconvene in March to finalize the terms of reference of the subcommittees in charge of the implementation of the agreement.,S/2020/360_PAR_14_SEN_10
"Because of COVID -19, that meeting was postponed.",S/2020/360_PAR_14_SEN_11
My acting Special Representative was in direct contact with Mr. Serraj and General Haftar to urge them to respond to the draft agreement.,S/2020/360_PAR_14_SEN_12
"On 26 February, UNSMIL convened a meeting of the Libyan Political Forum, the political track of the intra -Libyan dialogue, in Geneva.",S/2020/360_PAR_15_SEN_1
"A total of 50 members of the House of Representatives and the High Council of State, other political representatives, women leaders and civil society representatives were invited to attend.",S/2020/360_PAR_15_SEN_2
"Shortly before the meeting, the High Council of State reaffirmed its commitment to the p olitical dialogue, but announced that the participation of its delegates would be contingent on progress made on military talks and on the return of displaced persons to their places of origin.",S/2020/360_PAR_15_SEN_3
"Also on 26 February, members of the House of Representatives d elegation representing the districts in eastern Libya and who were close to General Haftar withdrew amid disagreement over the selection of representatives of the House of Representatives at the talks.",S/2020/360_PAR_15_SEN_4
The launch of the three tracks of the dialogue en joyed significant support in Libya.,S/2020/360_PAR_16_SEN_1
"On 4 March, 130 prominent Libyans, representing the business community, academia, technocrats, civil society and young people, called for a continuation of the three tracks as the only way to protect Libya from the spect re of war and destruction.",S/2020/360_PAR_16_SEN_2
"As at 27 April, the meetings of the three UNSMIL -facilitated tracks had been postponed owing mainly to measures taken in response to COVID -19.",S/2020/360_PAR_16_SEN_3
"UNSMIL, however, continued to engage with all Libyan representatives on the three trac ks with a view to resuming the meetings as soon as possible.",S/2020/360_PAR_16_SEN_4
International follow -up committee to the Berlin Conference,S/2020/360_PAR_16_SEN_5
"Under the co -chairmanship of the Government of Germany and UNSMIL, the international follow -up committee to the Berlin Conferenc e held its inaugural meeting in Munich, Germany, on 16 February.",S/2020/360_PAR_17_SEN_1
Representatives of South Africa and Tunisia joined the committee as participants.,S/2020/360_PAR_17_SEN_2
"As the executive secretariat of the Berlin Process, the committee is an essential tool for progressively turn ing the principles of the conclusions of the Berlin Conference into tangible action.",S/2020/360_PAR_17_SEN_3
"Its next meeting, scheduled to be held in Rome on 19 March under the joint chairmanship of the Government of Italy and UNSMIL, was postponed owing to the pandemic.",S/2020/360_PAR_17_SEN_4
"On 2 April, UNSMIL chaired the second meeting of the follow -up committee, held on closed -circuit television.",S/2020/360_PAR_18_SEN_1
Participants reiterated their call upon both parties to cease military operations and commit themselves to a humanitarian pause to focus national effo rts on addressing COVID -19.,S/2020/360_PAR_18_SEN_2
Participants stressed the need to maximize international efforts to achieve a permanent ceasefire between the parties to the conflict and encourage the Libyan parties to continue their engagement on the three UNSMIL -facilitated tracks of the dialogue.,S/2020/360_PAR_18_SEN_3
"Participants agreed on the co -chairs of three committee working groups (political, security and economic).",S/2020/360_PAR_18_SEN_4
The co-chairmanship of the international humanitarian law and human rights working group was opened to Member States outsid e the Berlin format after the Netherlands Page 5 and Switzerland formally expressed interest in co -chairing that group.,S/2020/360_PAR_18_SEN_5
"Following the agreement on the co -chairmanship of the three working groups, the political and economic group each met once, while the security group met four times by videoconference.",S/2020/360_PAR_18_SEN_6
International and regional engagement,S/2020/360_PAR_18_SEN_7
"In addition to cooperating in the Berlin Process, the United Nations sustained its engagement with international and regional stakeholders to enlist support for a politi cal solution to the Libyan conflict.",S/2020/360_PAR_19_SEN_1
"My former Special Representative attended the eighth Summit of the Ad Hoc High -level Committee on Libya of the African Union, hosted by the President of the Congo in Brazzaville on 30 January.",S/2020/360_PAR_19_SEN_2
"During a trilateral meetin g with the Chair of the African Union Commission and the High - Level Committee, held in Addis Ababa on 8 February, I tabled a number of proposals to enhance cooperation and synergies between the United Nations and the African Union on Libya.",S/2020/360_PAR_19_SEN_3
"On 9 February, I participated in the African Union summit, held in Addis Ababa, during which the Assembly of the African Union adopted a decision to support the convening by the African Union of an inter -Libyan reconciliation conference, in line with the conclus ions of the Berlin Conference.",S/2020/360_PAR_19_SEN_4
"On 11 and 12 March, my Chef de Cabinet represented me, heading a delegation, which included my Special Representative to the African Union and the Acting Special Representative for Libya, to the inaugural meeting of the Cont act Group of the Ad Hoc High -level Committee on Libya of the African Union, held in Oyo, the Congo.",S/2020/360_PAR_19_SEN_5
The Contact Group decided that the reconciliation conference would be organized in Addis Ababa and expressed the determination of the African Union to coope rate closely with the United Nations to advance the implementation of the conclusions of the Berlin Conference.,S/2020/360_PAR_19_SEN_6
"On 31 March, the European Union officially launched a new Common Security and Defence Policy military operation in the Mediterranean, opera tion EUNAVFOR MED IRINI, effective 1 April, for an initial period of one year, replacing the European Union military operation in the Southern Central Mediterranean, EUNAVFOR MED operation Sophia, whose mandate ended on 31 March.",S/2020/360_PAR_20_SEN_1
"The new operation’s core mandate is to contribute to the implementation of the United Nations arms embargo through the use of aerial, satellite and maritime assets.",S/2020/360_PAR_20_SEN_2
"Inspections will be carried out of vessels on the high seas off the coast of Libya that are suspected to be carrying arms or related materiel to and from Libya, in strict accordance with Security Council resolution 2292 (2016) and other relevant resolutions.",S/2020/360_PAR_20_SEN_3
"The operation will also monitor illicit oil exports, build the capacity of and train the Coast Guard and Navy of Libya and support the detection and monitoring of human smuggling and trafficking networks through information gathering and patrolling by aerial assets.",S/2020/360_PAR_20_SEN_4
"On 8 April, at the request of the Security Council, the Under -Secretary -General for Political and Peacebuilding Affairs and the Deputy Secretary -General of the European External Action Service briefed the Co uncil EUNAVFOR MED operation",S/2020/360_PAR_21_SEN_1
IRINI.,S/2020/360_PAR_22_SEN_1
Situation in the western region,S/2020/360_PAR_22_SEN_2
"During the reporting period, armed clashes, shelling and air strikes continued along the front lines of southern Tripoli.",S/2020/360_PAR_23_SEN_1
The intensity of the attacks became acute during the political and military talks held in Geneva.,S/2020/360_PAR_23_SEN_2
"Intense fighting also occurred in ot her cities in western Libya, including Abu Qurayn, Gharyan, Misratah, Qarabulli, Sabratah, Surman and Zuwarah.",S/2020/360_PAR_23_SEN_3
"In Tripoli, the Libyan National Army reinforced its positions in the Abu Salim, Salah al -Din and Ayn Zarah districts with personnel, armoure d vehicles and Page 6 weaponry, including heavy artillery batteries, ammunition shipments and additional infantry elements.",S/2020/360_PAR_24_SEN_1
"The Libyan National Army also targeted alleged Government of National Accord reinforcements, including from foreign sources.",S/2020/360_PAR_24_SEN_2
"On 18 February , the Libyan National Army targeted the Tripoli port with a barrage of heavy artillery and Grad rockets aimed at destroying a cargo vessel allegedly delivering military equipment to the Government of National Accord.",S/2020/360_PAR_24_SEN_3
"Later that day and on 29 February, uncr ewed aerial vehicles operated in support of the Government of National Accord attempted to target Libyan National Army positions south of the Ayn Zarah district, but were shot down by Libyan National Army air defence systems.",S/2020/360_PAR_24_SEN_4
"The concentration of forces by both parties was confirmed in the Zatarnah area and Qarabulli, where clashes had been reported, with the Libyan National Army unsuccessfully attempting to reach the eastern coastal road to disrupt the connection between Misratah and Tripoli.",S/2020/360_PAR_24_SEN_5
"In addition, major Libyan National Army reinforcements reportedly arrived in Aziziyah and the Hayrah area north of Gharyan, which the Libyan National Army lost to the Government of National Accord in June 2019 and has been trying to reclaim.",S/2020/360_PAR_24_SEN_6
"On 22 January, the Li byan National Army further extended its previously declared no -fly zone southwards, towards Gharyan and Tarhunah, and threatened to shoot down any military or civilian aircraft approaching Mitiga Airport, in Tripoli.",S/2020/360_PAR_25_SEN_1
"The airport was targeted with indirect fire in a string of Libyan National Army attacks with indirect fire by forces, with a peak of 50 shells on 28 February.",S/2020/360_PAR_25_SEN_2
The attacks disrupted the airport’s operation and resulted in civilian casualties and damage to nearby civilian homes.,S/2020/360_PAR_25_SEN_3
"Notwithstand ing initial positive responses by both sides to the call for a humanitarian truce by both sides, heavy artillery fire continued on 21 March along the front lines in Tripoli.",S/2020/360_PAR_26_SEN_1
"On 24 March, repeated shelling, reportedly by Libyan National Army -affiliated forc es, impacted the Ayn Zarah district, including the Ruwaymi prison.",S/2020/360_PAR_26_SEN_2
"UNSMIL condemned the attacks, which had resulted in several injuries, reportedly including inmates and judicial police.",S/2020/360_PAR_26_SEN_3
"On 25 March, an attack by Government of National Accord forces agains t the airbase in Watiyah was repelled by the Libyan National Army, aided by reinforcements from the strategic western coastal cities of Sabratah and Surman.",S/2020/360_PAR_26_SEN_4
"Government of National Accord forces reportedly gained control over Surman and Sabratah, as well as Ujaylat, Raqdalin, Jumayl, Zaltan and Assah.",S/2020/360_PAR_26_SEN_5
The developments could endanger the previous fragile stability in towns close to the Tunisian border that have thus far not been affected directly by the conflict.,S/2020/360_PAR_26_SEN_6
"Thus far in 2020, 12 reported attacks have impacted 7 health facilities in Libya, while in 2019, 62 attacks impacted 19 health facilities throughout the country.",S/2020/360_PAR_27_SEN_1
"On 4 March 2020, 10 schools in Ayn Zarah and all schools in Misratah that had been closed for more than a month reopened, allowing 127, 000 students to return.",S/2020/360_PAR_27_SEN_2
"However, on 8 March, eight schools near Mitiga Airport were closed owing to the risks posed by shelling.",S/2020/360_PAR_27_SEN_3
"As at 16 March, at least 930 families (approximately 4,650 persons) were reported to have fled to neighbouring areas.",S/2020/360_PAR_27_SEN_4
Vital services and civilian infrastructure continued to be impacted by the hostilities.,S/2020/360_PAR_28_SEN_1
"On 6 April, an attack on the Great Man -Made River Project in Shuwayrif left some 2 million persons without water for more than a week.",S/2020/360_PAR_28_SEN_2
"Following a mediated solution, the r esumption of water distribution was complicated by the hindering of the supply of natural gas to power stations in Misratah and Khums by another armed group in a different area.",S/2020/360_PAR_28_SEN_3
Page 7 Situation in the eastern region,S/2020/360_PAR_28_SEN_4
"In the eastern region, there were cont inued reports of criminal activity and incidents related to explosive remnants of war.",S/2020/360_PAR_29_SEN_1
"On 23 February, the police in Benghazi reportedly arrested a prominent drug dealer.",S/2020/360_PAR_29_SEN_2
"Demonstrations in support of the Libyan National Army and against Turkish interventio n were held in several cities, including at the United Nations hub in Benghazi, with one demonstration turning violent.",S/2020/360_PAR_29_SEN_3
"On 18 January, the National Oil Corporation declared a force majeure on oil exports from ports in eastern Libya following demonstra tions that day accompanied by calls from the Libyan National Army for ports to be shut down.",S/2020/360_PAR_30_SEN_1
"Oil exports from the eastern ports of Burayqah, Ra’s Lanuf, Hariqah Zuwaytinah and Sidr were halted.",S/2020/360_PAR_30_SEN_2
