doc_text,name,lat,lon,country_code3,admin1_name,admin2_name,feature_code,start_char,end_char
S/2021/62_PAR_41_SEN_2,"On 23 September, the ISIL Emir for North Africa, Abu Moaz al -Iraqi, was reported killed during one of these operations on 14 September.",South Africa,-29.0,24.0,ZAF,,,PCLI,35,47
S/2021/62_PAR_41_SEN_3,"On 27 November, the Libyan National Army dismantled a support network of AQIM in Awbari, with the arrest of elements accused of being arms and drug dealers.",Ubari,26.59034,12.77511,LBY,Wādī al Ḩayāt,,PPLA,81,87
S/2021/62_PAR_43_SEN_2,"According to the Economic and Social Commission for Western Asia (ESCWA), the cost of the confl ict in Libya since its outbreak in 2011 exceeds $576 billion.",Libya,28.0,17.0,LBY,,,PCLI,103,108
S/2021/62_PAR_43_SEN_5,"In less than a year, Libya’s foreign currency reserves dropped from $78 billion to $57 billion, while the country’s economy continues to rely heavily on global oil prices.",Libya,28.0,17.0,LBY,,,PCLI,21,26
S/2021/62_PAR_44_SEN_5,Other activities of the Un ited Nations Support Mission in Libya A.,Libya,28.0,17.0,LBY,,,PCLI,59,64
S/2021/62_PAR_45_SEN_1,"Despite challenges related to instability and coronavirus disease (COVID -19), the Committee for Municipal Council Elections organized eight municipal council elections between August and D ecember in Misratah, Ghat, Rajban and Zawiyah al-Gharbiyah.",Mişrātah,32.37535,15.09254,LBY,Mişrātah,,PPLA,201,209
S/2021/62_PAR_45_SEN_1,"Despite challenges related to instability and coronavirus disease (COVID -19), the Committee for Municipal Council Elections organized eight municipal council elections between August and D ecember in Misratah, Ghat, Rajban and Zawiyah al-Gharbiyah.",Kiryat Gat,31.60998,34.76422,ISR,Southern District,,PPL,211,215
S/2021/62_PAR_45_SEN_1,"Despite challenges related to instability and coronavirus disease (COVID -19), the Committee for Municipal Council Elections organized eight municipal council elections between August and D ecember in Misratah, Ghat, Rajban and Zawiyah al-Gharbiyah.",Rājban,30.52633,77.66282,IND,Himachal Pradesh,Sirmaur,PPL,217,223
S/2021/62_PAR_45_SEN_1,"Despite challenges related to instability and coronavirus disease (COVID -19), the Committee for Municipal Council Elections organized eight municipal council elections between August and D ecember in Misratah, Ghat, Rajban and Zawiyah al-Gharbiyah.",Libya,28.0,17.0,LBY,,,PCLI,228,248
S/2021/62_PAR_45_SEN_3,"In January, four municipal elections were organized, including in municipalities in Tripoli.",Tripoli,34.43352,35.84415,LBN,Liban-Nord,,PPLA,84,91
S/2021/62_PAR_45_SEN_4,The Committee announced on 28 Dec ember that elections in Tajura’ and Sabratah would be held on 14 January.,Tadjourah,12.0,42.5,DJI,Tadjourah,,ADM1,58,64
S/2021/62_PAR_45_SEN_4,The Committee announced on 28 Dec ember that elections in Tajura’ and Sabratah would be held on 14 January.,Şabrātah,32.79335,12.48845,LBY,Az Zāwiyah,,PPL,70,78
S/2021/62_PAR_50_SEN_1,"During the reporting period, some journalists were reportedly arbitrarily arrested by Libyan National Army -affiliated groups in eastern Libya.",Libya,28.0,17.0,LBY,,,PCLI,137,142
S/2021/62_PAR_50_SEN_3,"In Tripoli, on 21 October, the head of the Libyan Media Association, Mohamed Omar Baaio, was illegally detained by an armed group, together with his two sons and the newly appointed head of p rogrammes of the Libya al -Wataniya television channel, Hind Ammar.",Tripoli,32.88743,13.18733,LBY,Tripoli,,PPLC,3,10
S/2021/62_PAR_55_SEN_2,"UNSMIL received reports of torture, deprivation of food and health care, enforced disappearances and sexual and gender -based violence against persons detained in the Suq al -Khamis, Abu Salim, Nasir and Abu Isa centres operated by the Directorate for Combating Illegal Migration.",Sūq al Khamīs,17.18126,43.28811,YEM,Şa‘dah,Monabbih,PPLA2,167,181
S/2021/62_PAR_55_SEN_2,"UNSMIL received reports of torture, deprivation of food and health care, enforced disappearances and sexual and gender -based violence against persons detained in the Suq al -Khamis, Abu Salim, Nasir and Abu Isa centres operated by the Directorate for Combating Illegal Migration.",Abū Salīm,32.84264,13.17093,LBY,,,PPLX,183,192
S/2021/62_PAR_55_SEN_2,"UNSMIL received reports of torture, deprivation of food and health care, enforced disappearances and sexual and gender -based violence against persons detained in the Suq al -Khamis, Abu Salim, Nasir and Abu Isa centres operated by the Directorate for Combating Illegal Migration.",Nāşir Shōr Āb,31.91305,65.85387,AFG,Kandahar,Shāh Walī Kōṯ,RUIN,194,199
S/2021/62_PAR_55_SEN_2,"UNSMIL received reports of torture, deprivation of food and health care, enforced disappearances and sexual and gender -based violence against persons detained in the Suq al -Khamis, Abu Salim, Nasir and Abu Isa centres operated by the Directorate for Combating Illegal Migration.",Abū ‘Īsá,32.75306,12.63105,LBY,Az Zāwiyah,,PPL,204,211
S/2021/62_PAR_56_SEN_1,"On 28 September, around 355 migrants and asylum seekers, including 258 men, 57 women and 40 children, were arrested by security forces at their homes, places of work and other gathering places in Ujaylat and the outskirts of Sabra tah.",Al ‘Ajalāt,32.76488,36.78185,SYR,As-Suwayda,,PPL,196,203
S/2021/62_PAR_56_SEN_1,"On 28 September, around 355 migrants and asylum seekers, including 258 men, 57 women and 40 children, were arrested by security forces at their homes, places of work and other gathering places in Ujaylat and the outskirts of Sabra tah.",Montenegro,42.75,19.25,MNE,,,PCLI,225,234
S/2021/62_PAR_56_SEN_2,"The migrants and asylum seekers were taken to the Dahman assembly point in Sabratah, controlled by the Directorate for Combating Illegal Migration and the Security Directorate under the Ministry of Defence.",Dahmān,32.78583,12.51528,LBY,Az Zāwiyah,,PPL,50,56
S/2021/62_PAR_56_SEN_2,"The migrants and asylum seekers were taken to the Dahman assembly point in Sabratah, controlled by the Directorate for Combating Illegal Migration and the Security Directorate under the Ministry of Defence.",Şabrātah,32.79335,12.48845,LBY,Az Zāwiyah,,PPL,75,83
S/2021/62_PAR_56_SEN_4,"On 1 October, at least three migrants were reportedly killed by armed men at the Dahman assembly point during a riot to protest the lack of food, medical care and potable water.",Dahman,34.26219,72.98616,PAK,Khyber Pakhtunkhwa,Mānsehra District,PPL,81,87
S/2021/62_PAR_57_SEN_1,"There were also continued reports of large -scale deportations by officials of the Directorate for Combating Illegal Migration along the southern border of Libya with Chad and Sudan under the so -called “emergency procedures”, raising concerns of collec tive expulsion and possible cases of refoulement, with the Kufrah detention centre becoming a de facto deportation centre.",Libya,28.0,17.0,LBY,,,PCLI,156,161
S/2021/62_PAR_57_SEN_1,"There were also continued reports of large -scale deportations by officials of the Directorate for Combating Illegal Migration along the southern border of Libya with Chad and Sudan under the so -called “emergency procedures”, raising concerns of collec tive expulsion and possible cases of refoulement, with the Kufrah detention centre becoming a de facto deportation centre.",Republic of Chad,15.0,19.0,TCD,,,PCLI,167,171
S/2021/62_PAR_57_SEN_1,"There were also continued reports of large -scale deportations by officials of the Directorate for Combating Illegal Migration along the southern border of Libya with Chad and Sudan under the so -called “emergency procedures”, raising concerns of collec tive expulsion and possible cases of refoulement, with the Kufrah detention centre becoming a de facto deportation centre.",Republic of the Sudan,16.0,30.0,SDN,,,PCLI,176,181
S/2021/62_PAR_57_SEN_1,"There were also continued reports of large -scale deportations by officials of the Directorate for Combating Illegal Migration along the southern border of Libya with Chad and Sudan under the so -called “emergency procedures”, raising concerns of collec tive expulsion and possible cases of refoulement, with the Kufrah detention centre becoming a de facto deportation centre.",Al Kufrah,23.76667,22.21667,LBY,Al Kufrah,,ADM1,313,319
S/2021/62_PAR_57_SEN_2,"A newly established Directorate desert patrol unit headquartered in Assah, reportedly initiated regular patrols and intensified secur ity checks along the Libyan border with Algeria, raising concerns as to discriminatory profiling and increased expulsions outside of process and procedural safeguards.",Al ‘Assah,32.82995,11.62926,LBY,An Nuqāţ al Khams,,PPL,68,73
S/2021/62_PAR_57_SEN_2,"A newly established Directorate desert patrol unit headquartered in Assah, reportedly initiated regular patrols and intensified secur ity checks along the Libyan border with Algeria, raising concerns as to discriminatory profiling and increased expulsions outside of process and procedural safeguards.",People’s Democratic Republic of Algeria,28.0,3.0,DZA,,,PCLI,174,181
S/2021/62_PAR_58_SEN_2,"In 2020, more than 11,900 migrants and refugees were intercepted at sea, disembarked in Libya and frequently transferred to arbitrary detention in abusive conditions, while others have disappeared altogether.",Libya,28.0,17.0,LBY,,,PCLI,88,93
S/2021/62_PAR_58_SEN_4,"There are currently more than 2,300 persons in eight officially registered detention centres in Libya, of whom 695 are persons of concern to the United Nations High Commissioner for Refugees (U NHCR).",Libya,28.0,17.0,LBY,,,PCLI,96,101
S/2021/62_PAR_59_SEN_2,"On 15 November, a vessel carrying migrants off the coast of Khums in western Libya sank, killing at least 74 migrants.",Al Khums,32.64861,14.26191,LBY,Al Marqab,,PPLA,60,65
S/2021/62_PAR_59_SEN_2,"On 15 November, a vessel carrying migrants off the coast of Khums in western Libya sank, killing at least 74 migrants.",Libya,28.0,17.0,LBY,,,PCLI,77,82
S/2021/62_PAR_59_SEN_3,"UNSMIL received multiple reports of fai lure to assist and pushbacks of migrant boats in the central Mediterranean, both by relevant international authorities and the Libyan Coast Guard.",Mediterranean Sea,35.0,20.0,NA,,,SEA,101,114
S/2021/62_PAR_60_SEN_3,Some 69 children remain detained with their mothers in Judayd ah prison.,Doha,25.28545,51.53096,QAT,Baladīyat ad Dawḩah,,PPLC,55,64
S/2021/62_PAR_61_SEN_1,"Cases of sexual and gender -based violence remain underreported in Libya owing to fear of reprisal, intimidation and mis placed stigma related to underlying discriminatory gender norms.",Libya,28.0,17.0,LBY,,,PCLI,67,72
S/2021/62_PAR_61_SEN_2,"To improve documentation of conflict -related sexual violence, UNSMIL established the monitoring, analysis and reporting arrangements on conflict -related sexual violence in Libya, in line with resolution 1960 (2010) .",Libya,28.0,17.0,LBY,,,PCLI,174,179
S/2021/62_PAR_62_SEN_1,"Despite ongoing challenges, the unified administration of justice saw signs of improvement, demonstrated by the collaboration of member s of the newly elected Supreme Judicial Council and the resumption of legal proceedings in the south, and in Sirte and Darnah.",Sirte,31.20892,16.58866,LBY,Surt,,PPLA,245,250
S/2021/62_PAR_62_SEN_1,"Despite ongoing challenges, the unified administration of justice saw signs of improvement, demonstrated by the collaboration of member s of the newly elected Supreme Judicial Council and the resumption of legal proceedings in the south, and in Sirte and Darnah.",Darnah,32.76704,22.63669,LBY,Darnah,,PPLA,255,261
S/2021/62_PAR_62_SEN_2,"Latest figures indicate that, from August to November, following UNSMIL advocacy, 11 court hearings took place inside Judaydah pr ison in Tripoli, resulting in the release of eight detainees.",Western Sahara,24.49215,-12.65625,ESH,,,TERR,118,134
S/2021/62_PAR_62_SEN_2,"Latest figures indicate that, from August to November, following UNSMIL advocacy, 11 court hearings took place inside Judaydah pr ison in Tripoli, resulting in the release of eight detainees.",Tripoli,32.88743,13.18733,LBY,Tripoli,,PPLC,138,145
S/2021/62_PAR_63_SEN_1,"The United Nations system in Libya continued to implement the human rights due diligence policy on United Nations support to non -United Nations securi ty forces (see A/67/775 -S/2013/110 , annex), with a view to preventing and mitigating the identified risks of grave violations of international humanitarian law, human rights law or refugee law.",Libya,28.0,17.0,LBY,,,PCLI,29,34
S/2021/62_PAR_64_SEN_2,"The Secretariat established a Libya planning team chaired by the Department of Political and Peacebuilding Affairs, which includes representatives of relevant components of the Department of Operational Support, the Department of Peace Operations, the Office of Legal Affairs and UNSMIL.",Libya,28.0,17.0,LBY,,,PCLI,30,35
S/2021/62_PAR_65_SEN_2,Activities were focused on the disposal of explosive ordnance and battle area clearance in southern Tripoli and Misratah.,Tripoli,32.88743,13.18733,LBY,Tripoli,,PPLC,100,107
S/2021/62_PAR_65_SEN_2,Activities were focused on the disposal of explosive ordnance and battle area clearance in southern Tripoli and Misratah.,Mişrātah,32.37535,15.09254,LBY,Mişrātah,,PPLA,112,120
S/2021/62_PAR_66_SEN_1,"The Mine Action Service also completed a project to reinforce information management capabilities to map explosive remnants of war contamination in Tripoli, to facilitate clearance operations and to support the protection of civil ians.",Trípoli,37.50889,22.37944,GRC,Peloponnese,Nomós Arkadías,PPLA,148,155
S/2021/62_PAR_66_SEN_2,"In response to the continuing threat from explosive remnants of war, humanitarian mine action sector partners trained and accredited six additional non -technical survey teams, which will conduct essential surveys in Tripoli and facilitate prioritizat ion of future clearance.",Tripoli,34.43352,35.84415,LBN,Liban-Nord,,PPLA,217,224
S/2021/62_PAR_70_SEN_1,"During the reporting period, UNDP and the United Nations Entity for Gender Equality and the Empowerment of Women (UN-Women ) provided training for 20 women and youth organizations across Libya to enhance their organizational skills in order to reduce inequality and promote women empowerment.",Libya,28.0,17.0,LBY,,,PCLI,187,192
S/2021/62_PAR_71_SEN_1,"On 11 October, five women judges were appointed to the two specialized courts established in Benghazi and Tripoli to address violence against women and children.",Benghazi,32.11486,20.06859,LBY,Banghāzī,,PPLA,93,101
S/2021/62_PAR_71_SEN_1,"On 11 October, five women judges were appointed to the two specialized courts established in Benghazi and Tripoli to address violence against women and children.",Trípoli,37.50889,22.37944,GRC,Peloponnese,Nomós Arkadías,PPLA,106,113
S/2021/62_PAR_73_SEN_1,"The Youth against COVID -19 Fund, established by the United Nations Population Fund and a national partner organization, supported youth -led initiatives combating the C OVID -19 pandemic in Benghazi, Sabhah, Ghat and Sirte.",Benghazi,32.11486,20.06859,LBY,Banghāzī,,PPLA,191,199
S/2021/62_PAR_73_SEN_1,"The Youth against COVID -19 Fund, established by the United Nations Population Fund and a national partner organization, supported youth -led initiatives combating the C OVID -19 pandemic in Benghazi, Sabhah, Ghat and Sirte.",Sabhā,27.03766,14.42832,LBY,Sabhā,,PPLA,201,207
S/2021/62_PAR_73_SEN_1,"The Youth against COVID -19 Fund, established by the United Nations Population Fund and a national partner organization, supported youth -led initiatives combating the C OVID -19 pandemic in Benghazi, Sabhah, Ghat and Sirte.",Ghat,24.96334,10.18003,LBY,Ghāt,,PPLA,209,213
S/2021/62_PAR_73_SEN_1,"The Youth against COVID -19 Fund, established by the United Nations Population Fund and a national partner organization, supported youth -led initiatives combating the C OVID -19 pandemic in Benghazi, Sabhah, Ghat and Sirte.",Sirte,31.20892,16.58866,LBY,Surt,,PPLA,218,223
S/2021/62_PAR_77_SEN_1,"Following the suspension of hostilities in southern Tripoli in June 2020, there has been a slow decrease in the number of displaced persons, from 426,000 in June to 316,000 in December.",Tripoli,32.88743,13.18733,LBY,Tripoli,,PPLC,52,59
S/2021/62_PAR_78_SEN_1,"The number of migrants and refugees in Libya has steadily dec reased, from 626,000 in April to 574,000 in November, in part as a result of a reduction in labour opportunities for migrant workers, increased unemployment and tightened security controls and COVID -19 mobility restrictions implemented by the authorities.",Libya,28.0,17.0,LBY,,,PCLI,39,44
S/2021/62_PAR_79_SEN_4,"While 31 laboratories are operational in the country, there are persistent and acute shortages of COVID -19 testing supplies, and response capacity is mostly concentrated in Tripoli, Misratah and Benghazi.",Tripoli,32.88743,13.18733,LBY,Tripoli,,PPLC,174,181
S/2021/62_PAR_79_SEN_4,"While 31 laboratories are operational in the country, there are persistent and acute shortages of COVID -19 testing supplies, and response capacity is mostly concentrated in Tripoli, Misratah and Benghazi.",Mişrātah,32.37535,15.09254,LBY,Mişrātah,,PPLA,183,191
S/2021/62_PAR_79_SEN_4,"While 31 laboratories are operational in the country, there are persistent and acute shortages of COVID -19 testing supplies, and response capacity is mostly concentrated in Tripoli, Misratah and Benghazi.",Benghazi,32.11486,20.06859,LBY,Banghāzī,,PPLA,196,204
S/2021/62_PAR_80_SEN_1,"The UNSMIL national reconciliation project, implemented with UNDP and WHO, supported a health diplomacy initiative to strengthen the COVID -19 response and helped increase awareness of needs and response planning , as well as build longer -term mechanisms for public health cooperation throughout Libya.",Libya,28.0,17.0,LBY,,,PCLI,297,302
S/2021/62_PAR_80_SEN_2,"On 12 September, virtual exchanges were held with over 30 health -care professionals i n Benghazi, Misratah, Sabhah and Tripoli, resulting in a COVID -19 preparedness assessment and performance cooperation goals.",Benghazi,32.11486,20.06859,LBY,Banghāzī,,PPLA,89,97
S/2021/62_PAR_80_SEN_2,"On 12 September, virtual exchanges were held with over 30 health -care professionals i n Benghazi, Misratah, Sabhah and Tripoli, resulting in a COVID -19 preparedness assessment and performance cooperation goals.",Mişrātah,32.37535,15.09254,LBY,Mişrātah,,PPLA,99,107
S/2021/62_PAR_80_SEN_2,"On 12 September, virtual exchanges were held with over 30 health -care professionals i n Benghazi, Misratah, Sabhah and Tripoli, resulting in a COVID -19 preparedness assessment and performance cooperation goals.",Sabhā,27.03766,14.42832,LBY,Sabhā,,PPLA,109,115
S/2021/62_PAR_80_SEN_2,"On 12 September, virtual exchanges were held with over 30 health -care professionals i n Benghazi, Misratah, Sabhah and Tripoli, resulting in a COVID -19 preparedness assessment and performance cooperation goals.",Tripolitania,31.0,15.0,LBY,,,RGN,120,127
S/2021/62_PAR_80_SEN_6,"In view of the continued sabotage of the Great Man -Made River infrastructure, the national reconciliation project increased its engagement with the local communities to improve communication channels with the Great Man -Made River project and the General Electricity Company of Libya and begin working on mutually beneficial projects.",Libya,28.0,17.0,LBY,,,PCLI,279,284
S/2021/62_PAR_83_SEN_1,The negative soci oeconomic impact of the conflict and COVID -19 are stretching the coping capacities and resilience of people throughout Libya.,Libya,28.0,17.0,LBY,,,PCLI,138,143
S/2021/62_PAR_84_SEN_3,"Sig nificant progress was also made on the issuance of visas by the authorities for international humanitarian staff, following nearly eight months of visas not being issued for international staff by international NGOs working in Libya.",Libya,28.0,17.0,LBY,,,PCLI,231,236
S/2021/62_PAR_85_SEN_1,Humanitarian agencies and partners continued to support the COVID -19 response in Libya.,Libya,28.0,17.0,LBY,,,PCLI,82,87
S/2021/62_PAR_85_SEN_3,"Humanitarian agencies are working with the authorities to strengthen a nd expand disease surveillance across Libya, including the development of standard criteria for reporting confirmed COVID -19 cases and establishing early warning and event -based surveillance.",Libya,28.0,17.0,LBY,,,PCLI,109,114
S/2021/62_PAR_86_SEN_5,The UNDP resilience and recovery project provided support to 52 municipalities across Libya to improve access to quality basic and social services for the most vulnerable groups .,Libya,28.0,17.0,LBY,,,PCLI,86,91
S/2021/62_PAR_86_SEN_6,"The UNDP Stabilization Facility for Libya completed 292 projects across the country, with an additional 42 projects to support the rehabilitation of schools and medical facilities and improve sanitation services.",Libya,28.0,17.0,LBY,,,PCLI,36,41
S/2021/62_PAR_86_SEN_8,Deployment of the United Nations Support Mission in Libya and security arrangements,Libya,28.0,17.0,LBY,,,PCLI,52,57
S/2021/62_PAR_87_SEN_1,"During the reporting period, the United Nations maintained an international civilian staff presence in Libya of 60 to 90 international staff on a rotational basis, with most international staff in T ripoli and a small presence in the Benghazi hub.",Libya,28.0,17.0,LBY,,,PCLI,103,108
S/2021/62_PAR_87_SEN_1,"During the reporting period, the United Nations maintained an international civilian staff presence in Libya of 60 to 90 international staff on a rotational basis, with most international staff in T ripoli and a small presence in the Benghazi hub.",Georgia,41.99998,43.4999,GEO,,,PCLI,197,205
S/2021/62_PAR_87_SEN_1,"During the reporting period, the United Nations maintained an international civilian staff presence in Libya of 60 to 90 international staff on a rotational basis, with most international staff in T ripoli and a small presence in the Benghazi hub.",Benghazi,32.11486,20.06859,LBY,Banghāzī,,PPLA,234,242
S/2021/62_PAR_88_SEN_2,"All international staff in Tripoli continued to be accommodated at the Oea compound, which continues to be protected by the United Nations Guard Unit.",Tripoli,34.43352,35.84415,LBN,Liban-Nord,,PPLA,27,34
S/2021/62_PAR_90_SEN_1,The rotation of the United Nations Guard Unit was conducted with two flights on 31 October and 20 November from Kathmandu to Tripoli.,Kathmandu,27.70169,85.3206,NPL,Bagmati Province,Kathmandu,PPLC,112,121
S/2021/62_PAR_90_SEN_1,The rotation of the United Nations Guard Unit was conducted with two flights on 31 October and 20 November from Kathmandu to Tripoli.,Tripoli,32.88743,13.18733,LBY,Tripoli,,PPLC,125,132
S/2021/62_PAR_90_SEN_2,"Road movements in Tripo li were conducted in strict compliance with security risk management measures and reduced to those absolutely necessary, in view of the COVID -19 pandemic.",Georgia,41.99998,43.4999,GEO,,,PCLI,18,26
S/2021/62_PAR_91_SEN_1,"Sustained international engagement acro ss the UNSMIL -facilitated intra -Libyan dialogues has generated considerable impetus, demonstrated by tangible progress on the political, security, economic and international humanitarian law and human rights tracks, moving Libya forward on the road to peace, stab ility and development.",Libya,28.0,17.0,LBY,,,PCLI,265,270
S/2021/62_PAR_93_SEN_1,"I welcome the outcome of the Libyan Political Dialogue Forum, held in Tunisia in November, culminating in a road map leading to the holding of national elections on 24 December 2021, and an agreement on a structure of a reformed executive authority.",Republic of Tunisia,34.0,9.0,TUN,,,PCLI,70,77
S/2021/62_PAR_94_SEN_3,"This includes ensuring the departure of all foreign fighters and mercenaries f rom Libya, and full and unconditional respect for the Security Council arms embargo.",Libya,28.0,17.0,LBY,,,PCLI,83,88
S/2021/62_PAR_95_SEN_2,I reiterate the need to ensure a single and coordinated international approach in Libya .,Libya,28.0,17.0,LBY,,,PCLI,82,87
S/2021/62_PAR_95_SEN_3,I express my gratitude to the President and to the Government of Tunisia for hosting the Libyan Political Dialogue Forum.,Republic of Tunisia,34.0,9.0,TUN,,,PCLI,65,72
S/2021/62_PAR_99_SEN_5,"I also thank Germany, Italy, the United Kingdom and the European Union for their financial contributions for the holding of the Libyan Political Dialogue Forum.",Federal Republic of Germany,51.5,10.5,DEU,,,PCLI,13,20
S/2021/62_PAR_99_SEN_5,"I also thank Germany, Italy, the United Kingdom and the European Union for their financial contributions for the holding of the Libyan Political Dialogue Forum.",Italian Republic,42.83333,12.83333,ITA,,,PCLI,22,27
S/2021/62_PAR_99_SEN_5,"I also thank Germany, Italy, the United Kingdom and the European Union for their financial contributions for the holding of the Libyan Political Dialogue Forum.",United Kingdom of Great Britain and Northern Ireland,54.75844,-2.69531,GBR,,,PCLI,29,47
S/2021/62_PAR_100_SEN_1,"Armed groups throughout Libya hold thousands of men, women and children in prolonged arbitrary and unlawful detention and subject them to torture, sexual violence and other human rights abuses.",Libya,28.0,17.0,LBY,,,PCLI,24,29
S/2021/62_PAR_101_SEN_2,Refugees and migrants in Libya should be released from detention and provided with safe shelte r.,Libya,28.0,17.0,LBY,,,PCLI,25,30
S/2021/62_PAR_101_SEN_3,Libya is not considered to be a safe port of disembarkation for refugees and migrants.,Libya,28.0,17.0,LBY,,,PCLI,0,5
S/2021/62_PAR_101_SEN_4,I urge relevant Member States to revisit policies that support the interception at sea and return of refugees and migrants to Libya.,Libya,28.0,17.0,LBY,,,PCLI,126,131
