doc_text,name,lat,lon,country_code3,admin1_name,admin2_name,feature_code,start_char,end_char
S/2022/632_PAR_15_SEN_2,"As agreed by the Commission, the clearance of mines and improvised explosive devices required for the reopening of the southern road between Abu Qurayn and Jufrah began along the western part o f the road to allow the free movement of peoples and merchandise.",Abū Qurayn,13.16667,31.2,SDN,North Kordofan,,PPL,141,151
S/2022/632_PAR_15_SEN_2,"As agreed by the Commission, the clearance of mines and improvised explosive devices required for the reopening of the southern road between Abu Qurayn and Jufrah began along the western part o f the road to allow the free movement of peoples and merchandise.",Jufrah,32.38333,43.71667,IRQ,Karbalāʼ,,MRSH,156,162
S/2022/632_PAR_16_SEN_1,"On 16 June, the Chiefs of General St aff of the Libyan Army and of the Libyan National Army, Lieutenant General Mohammed al -Haddad and General Mohammed Nadhouri respectively, met in Cairo, together with the 5+5 Joint Military Commission and the Special Adviser.",Cairo,30.06263,31.24967,EGY,Cairo,,PPLC,183,188
S/2022/632_PAR_16_SEN_4,"The Special Adviser also facilitated a meeting of the Commission with the joint committee of the House of Representatives and the High State Council, in Cairo on 16 June, to address the remaining challenges to the reunif ication of the armed forces and the full implementation of the ceasefire agreement.",Cairo,30.06263,31.24967,EGY,Cairo,,PPLC,153,158
S/2022/632_PAR_16_SEN_6,International Follow -up Committee on Libya of the Berlin process,Berlin,52.52437,13.41053,DEU,Berlin,,PPLC,51,57
S/2022/632_PAR_17_SEN_1,The International Follow -up Committee on Libya of the Berlin process and its working groups continued to serve as the overall framework for international support for the intra -Libyan dialogue tracks.,Berlin,52.52437,13.41053,DEU,Berlin,,PPLC,55,61
S/2022/632_PAR_18_SEN_1,"On 7 June, the security working group, co -chaired by the United Nations, France, Italy, Türkiye, the United Kingdom and the African Union , met with the 5+5 Joint Military Commission in Tunis to discuss steps for proceeding with the operationalization of the action plan for a gradual, balanced and sequenced withdrawal of mercenaries, foreign fighters and foreign forces.",Republic of France,46.0,2.0,FRA,,,PCLI,74,80
S/2022/632_PAR_18_SEN_1,"On 7 June, the security working group, co -chaired by the United Nations, France, Italy, Türkiye, the United Kingdom and the African Union , met with the 5+5 Joint Military Commission in Tunis to discuss steps for proceeding with the operationalization of the action plan for a gradual, balanced and sequenced withdrawal of mercenaries, foreign fighters and foreign forces.",Italian Republic,42.83333,12.83333,ITA,,,PCLI,82,87
S/2022/632_PAR_18_SEN_1,"On 7 June, the security working group, co -chaired by the United Nations, France, Italy, Türkiye, the United Kingdom and the African Union , met with the 5+5 Joint Military Commission in Tunis to discuss steps for proceeding with the operationalization of the action plan for a gradual, balanced and sequenced withdrawal of mercenaries, foreign fighters and foreign forces.",United Kingdom of Great Britain and Northern Ireland,54.75844,-2.69531,GBR,,,PCLI,98,116
S/2022/632_PAR_18_SEN_1,"On 7 June, the security working group, co -chaired by the United Nations, France, Italy, Türkiye, the United Kingdom and the African Union , met with the 5+5 Joint Military Commission in Tunis to discuss steps for proceeding with the operationalization of the action plan for a gradual, balanced and sequenced withdrawal of mercenaries, foreign fighters and foreign forces.",Republic of Tunisia,34.0,9.0,TUN,,,PCLI,187,192
S/2022/632_PAR_19_SEN_1,"In a statement made on 16 June, the Co -Chairs of the international humanitarian law and human rights working group (the United Nations, the Netherlands and Switzerland) called upon the Human Rights Council to extend the mandate of the Independent Fact -Finding Mission on Libya so as to en able it to continue its critical work to advance human rights, sustainable peace and rights -based national reconciliation.",Kingdom of the Netherlands,52.25,5.75,NLD,,,PCLI,141,152
S/2022/632_PAR_19_SEN_1,"In a statement made on 16 June, the Co -Chairs of the international humanitarian law and human rights working group (the United Nations, the Netherlands and Switzerland) called upon the Human Rights Council to extend the mandate of the Independent Fact -Finding Mission on Libya so as to en able it to continue its critical work to advance human rights, sustainable peace and rights -based national reconciliation.",Switzerland,47.00016,8.01427,CHE,,,PCLI,157,168
S/2022/632_PAR_20_SEN_1,"The economic working group, co -chaired by the United Nations, Egypt, the European Union and the United States, sought the views of relevant Libyan institutions on the parameters of a possible short -term financing mechanism to fund, in a consensual and transparent manner, critical priorities and needs, including with regard to the National Oil Corporation.",Arab Republic of Egypt,27.0,30.0,EGY,,,PCLI,63,68
S/2022/632_PAR_20_SEN_1,"The economic working group, co -chaired by the United Nations, Egypt, the European Union and the United States, sought the views of relevant Libyan institutions on the parameters of a possible short -term financing mechanism to fund, in a consensual and transparent manner, critical priorities and needs, including with regard to the National Oil Corporation.",United States,39.76,-98.5,USA,,,PCLI,93,110
S/2022/632_PAR_20_SEN_2,"The Co -Chairs met in Tunis, on 26 May, to discuss the modalities for the establishment and operationalization of such a funding mechanism.",Tunis,36.81897,10.16579,TUN,Tūnis,,PPLC,22,27
S/2022/632_PAR_20_SEN_3,"Subsequently, draft terms of reference for a proposed Libyan special committee for over sight were circulated by the United States for consideration by senior Libyan officials of the House of Representatives Finance Committee, the Presidency Council, the Ministry of Finance, the Audit Bureau and the Administrative Control Authority, as well a s the other Co -Chairs of the working group.",United States,39.76,-98.5,USA,,,PCLI,113,130
S/2022/632_PAR_21_SEN_1,"During the reporting period, the Special Adviser and UNSMIL held regular consultations with regional and international stakeholders, both in Libya and abroad, on th e three intra -Libyan dialogue tracks.",Libya,28.0,17.0,LBY,,,PCLI,141,146
S/2022/632_PAR_21_SEN_2,The Special Adviser and UNSMIL participated upon request in meetings organized by Member States to provide briefings on the developments in Libya and updates on the status of United Nations mediation efforts.,Libya,28.0,17.0,LBY,,,PCLI,140,145
S/2022/632_PAR_22_SEN_1,"On 1 June, the Special Adviser, together with the Assistant Secretary -General and Mission Coordinator of UNSMIL and the United Nations Assistant Secretary - General, Resident and Humanitarian Coordinator for Libya, gave briefings to representatives of the intern ational diplomatic community.",Libya,28.0,17.0,LBY,,,PCLI,209,214
S/2022/632_PAR_22_SEN_2,"On 9 and 10 June, the Special Adviser visited Algeria for meetings with the Minister of Foreign Affairs and senior officials on the Libyan political process and progress made on the constitutional track.",People’s Democratic Republic of Algeria,28.0,3.0,DZA,,,PCLI,46,53
S/2022/632_PAR_22_SEN_3,"On 22 June, the Specia l Adviser met, in Oslo, with the Norwegian and German Special Representatives for Libya to discuss the next steps regarding the constitutional track.",Oslo,59.91273,10.74609,NOR,Oslo,Oslo,PPLC,41,45
S/2022/632_PAR_22_SEN_3,"On 22 June, the Specia l Adviser met, in Oslo, with the Norwegian and German Special Representatives for Libya to discuss the next steps regarding the constitutional track.",Libya,28.0,17.0,LBY,,,PCLI,105,110
S/2022/632_PAR_23_SEN_1,"From 22 to 24 June, an African Union delegation headed by the Minister for Foreign Affairs of the Con go, Jean -Claude Gakosso, representing the Chairperson of the African Union High -level Committee on Libya, visited Libya and met with senior Libyan officials, as well as with UNSMIL.",Libya,28.0,17.0,LBY,,,PCLI,218,223
S/2022/632_PAR_24_SEN_1,"On 5 July, the Special Adviser travelled to Paris where she met with the French Special Envoy for Libya and senior officials.",Paris,48.85341,2.3488,FRA,Île-de-France,Paris,PPLC,44,49
S/2022/632_PAR_24_SEN_1,"On 5 July, the Special Adviser travelled to Paris where she met with the French Special Envoy for Libya and senior officials.",Libya,28.0,17.0,LBY,,,PCLI,98,103
S/2022/632_PAR_24_SEN_2,"On 21 July, the Special Adviser travelled to Istanbul, Türkiye, to di scuss the progress made on the constitutional track during a gathering of Member States organized by Türkiye.",Istanbul,41.01384,28.94966,TUR,Istanbul,,PPLA,45,53
S/2022/632_PAR_25_SEN_1,"Continued political divisions contributed to a volatile security environment in Tripoli and across wes tern Libya, including as a result of demonstrations of support by security actors for Mr. Al Dabiba or Mr. Bashagha, and in response to Mr. Bashagha ’s attempt to enter Tripoli on 17 May.",Tripoli,32.88743,13.18733,LBY,Tripoli,,PPLC,80,87
S/2022/632_PAR_25_SEN_1,"Continued political divisions contributed to a volatile security environment in Tripoli and across wes tern Libya, including as a result of demonstrations of support by security actors for Mr. Al Dabiba or Mr. Bashagha, and in response to Mr. Bashagha ’s attempt to enter Tripoli on 17 May.",Libya,28.0,17.0,LBY,,,PCLI,108,113
S/2022/632_PAR_25_SEN_1,"Continued political divisions contributed to a volatile security environment in Tripoli and across wes tern Libya, including as a result of demonstrations of support by security actors for Mr. Al Dabiba or Mr. Bashagha, and in response to Mr. Bashagha ’s attempt to enter Tripoli on 17 May.",Tripoli,32.88743,13.18733,LBY,Tripoli,,PPLC,272,279
S/2022/632_PAR_25_SEN_2,"In Tripoli, there was an increased number of intermittent clashes bet ween armed groups, as well as sporadic shootings, including in densely populated areas.",Tripoli,34.43352,35.84415,LBN,Liban-Nord,,PPLA,3,10
S/2022/632_PAR_26_SEN_1,"On 26 May, a large convoy of Zintani forces supportive of Mr. Bashagha moved from Aziziyah to military camps south of Tripoli.",Al ‘Azīzīyah,32.90941,45.06359,IRQ,Wāsiţ,Qada Al-Azezia,PPLA2,82,90
S/2022/632_PAR_26_SEN_1,"On 26 May, a large convoy of Zintani forces supportive of Mr. Bashagha moved from Aziziyah to military camps south of Tripoli.",Tripoli,32.88743,13.18733,LBY,Tripoli,,PPLC,118,125
S/2022/632_PAR_26_SEN_3,"In addition, forces affiliated with the Government of National Unity strengthened their positions in central Tripoli, as well as in Tarhunah and Bani Walid.",Tripoli,32.88743,13.18733,LBY,Tripoli,,PPLC,109,116
S/2022/632_PAR_26_SEN_3,"In addition, forces affiliated with the Government of National Unity strengthened their positions in central Tripoli, as well as in Tarhunah and Bani Walid.",Tarhuna,32.43501,13.6332,LBY,Al Marqab,,PPL,132,140
S/2022/632_PAR_26_SEN_3,"In addition, forces affiliated with the Government of National Unity strengthened their positions in central Tripoli, as well as in Tarhunah and Bani Walid.",Bani Walid,31.74554,13.98354,LBY,Mişrātah,,PPL,145,155
S/2022/632_PAR_27_SEN_1,"On 9 June, one fighter was reportedly killed and two civilians injured in armed clashes in central Tripoli between members of the Nawasi Brigade and elements affiliated to the Stability Support Apparatus.",Tripoli,34.43352,35.84415,LBN,Liban-Nord,,PPLA,99,106
S/2022/632_PAR_27_SEN_3,"On 22 June, four armed elements and one civilian were reportedly killed in clashes between the Special Deterrence Force and the Stability Support Apparatus in central Tripoli .",Tripoli,34.43352,35.84415,LBN,Liban-Nord,,PPLA,167,174
S/2022/632_PAR_28_SEN_2,"On 19 and 20 Ju ne, Zintani forces based in southern Tripoli were further reinforced Page 6 by military units from Zintan and Aziziyah.",Tripoli,32.88743,13.18733,LBY,Tripoli,,PPLC,53,60
S/2022/632_PAR_28_SEN_2,"On 19 and 20 Ju ne, Zintani forces based in southern Tripoli were further reinforced Page 6 by military units from Zintan and Aziziyah.",Zintan,31.93155,12.25291,LBY,Jabal al Gharbi,,PPL,115,121
S/2022/632_PAR_28_SEN_2,"On 19 and 20 Ju ne, Zintani forces based in southern Tripoli were further reinforced Page 6 by military units from Zintan and Aziziyah.",‘Azīzīyah,35.67654,37.09368,SYR,Idlib,,PPL,126,134
S/2022/632_PAR_28_SEN_3,"The show of force was triggered by Mr. Al Dabiba ’s dismissal of Western Military Commander, General Osama al-Juwaili, from his position as the head of military intelligence in the aftermath of the Mr. Bashagha ’s attempt to enter Tripoli on 17 May.",Tripoli,34.43352,35.84415,LBN,Liban-Nord,,PPLA,231,238
S/2022/632_PAR_29_SEN_1,"Following a statement made by Mr. Bashagha on 9 July, in which he announced that his cabinet would begin operating from Tripoli, a series of military movements and mobil izations were reported in the capital city and the level of alert was again raised among the armed forces in western Libya.",Tripoli,32.88743,13.18733,LBY,Tripoli,,PPLC,120,127
S/2022/632_PAR_29_SEN_1,"Following a statement made by Mr. Bashagha on 9 July, in which he announced that his cabinet would begin operating from Tripoli, a series of military movements and mobil izations were reported in the capital city and the level of alert was again raised among the armed forces in western Libya.",Libya,28.0,17.0,LBY,,,PCLI,287,292
S/2022/632_PAR_29_SEN_2,"On 13 July, several commanders of armed groups gathered in Martyrs ’ Square in Tripoli and read a joint statement, warning that the s ecurity of Tripoli was “a red line ” and that they would confront any military forces attempting to “cause chaos ” in the capital.",Tripoli,32.88743,13.18733,LBY,Tripoli,,PPLC,79,86
S/2022/632_PAR_29_SEN_2,"On 13 July, several commanders of armed groups gathered in Martyrs ’ Square in Tripoli and read a joint statement, warning that the s ecurity of Tripoli was “a red line ” and that they would confront any military forces attempting to “cause chaos ” in the capital.",Tripoli,32.88743,13.18733,LBY,Tripoli,,PPLC,145,152
S/2022/632_PAR_30_SEN_1,"On 11 June, during a gathering in Suluq, south -east of Benghazi, tribal elders issued a communiqué calling for the removal of “all institutions whose term has expired ” and the simultaneous conduct of presidential and parliamentary elections by the end of 2 022.",Sulūk,36.59596,39.1299,SYR,Ar-Raqqah,,PPLA3,34,39
S/2022/632_PAR_30_SEN_1,"On 11 June, during a gathering in Suluq, south -east of Benghazi, tribal elders issued a communiqué calling for the removal of “all institutions whose term has expired ” and the simultaneous conduct of presidential and parliamentary elections by the end of 2 022.",Benghazi,32.11486,20.06859,LBY,Banghāzī,,PPLA,56,64
S/2022/632_PAR_31_SEN_1,"As part of the demonstrations that occurred across Libya on 1 July, demonstrators in Tubruq stormed the premises of the House of Representatives, demanding the chamber ’s dissolution while causing damage and setting fire to the building.",Libya,28.0,17.0,LBY,,,PCLI,51,56
S/2022/632_PAR_31_SEN_1,"As part of the demonstrations that occurred across Libya on 1 July, demonstrators in Tubruq stormed the premises of the House of Representatives, demanding the chamber ’s dissolution while causing damage and setting fire to the building.",Tobruk,32.08963,23.95385,LBY,Al Buţnān,,PPLA,85,91
S/2022/632_PAR_32_SEN_1,"Following armed clashes in Chad near the border with Libya from 23 to 27 May, the Libyan National Army intensified its counter -terrorism operations, with additional units being deployed near the border to limit the impact on Libyan territory of the fighting on the Chadian side.",Republic of Chad,15.0,19.0,TCD,,,PCLI,27,31
S/2022/632_PAR_32_SEN_1,"Following armed clashes in Chad near the border with Libya from 23 to 27 May, the Libyan National Army intensified its counter -terrorism operations, with additional units being deployed near the border to limit the impact on Libyan territory of the fighting on the Chadian side.",Libya,28.0,17.0,LBY,,,PCLI,53,58
S/2022/632_PAR_32_SEN_2,"On 1 June, the Army stated that reinforcements had been sent to Qatrun and Murzuq to prevent the infiltration of terrorists or criminals into Libya; however, the increased military presence triggere d tensions with some members of the Tebu tribe.",Al Qaţrūn,24.95139,14.64861,LBY,Murzuq,,PPL,64,70
S/2022/632_PAR_32_SEN_2,"On 1 June, the Army stated that reinforcements had been sent to Qatrun and Murzuq to prevent the infiltration of terrorists or criminals into Libya; however, the increased military presence triggere d tensions with some members of the Tebu tribe.",Murzuq,25.91552,13.91839,LBY,Murzuq,,PPLA,75,81
S/2022/632_PAR_32_SEN_2,"On 1 June, the Army stated that reinforcements had been sent to Qatrun and Murzuq to prevent the infiltration of terrorists or criminals into Libya; however, the increased military presence triggere d tensions with some members of the Tebu tribe.",Libya,28.0,17.0,LBY,,,PCLI,142,147
S/2022/632_PAR_33_SEN_1,"On 30 May, the Libyan National Army announced the capture of alleged Da ’esh Commander, Abu Muaz al -Tashani, south of Qatrun.",Al Qaţrūn,24.95139,14.64861,LBY,Murzuq,,PPL,119,125
S/2022/632_PAR_34_SEN_1,"On 18 June, the 444 Brigade reported the arrest of alleged Da ’esh Commander, Mustafa Bin Della, in Bani Walid.",Bani Walid,31.74554,13.98354,LBY,Mişrātah,,PPL,100,110
S/2022/632_PAR_43_SEN_2,UNSMIL received reports of a 1 -year- old girl who died in a Tripoli medical facility on 29 June because of a lack of oxygen caused by prolonged power outages.,Tripoli,34.43352,35.84415,LBN,Liban-Nord,,PPLA,61,68
S/2022/632_PAR_43_SEN_3,"There were also reports of a man operating a Page 8 small generator in the streets of Benghazi, on 25 June, in order to power an oxygen machine to enable his son to breathe.",Benghazi,32.11486,20.06859,LBY,Banghāzī,,PPLA,86,94
S/2022/632_PAR_45_SEN_1,"On 23 July, the Ministry of Health confirmed that 16 civilians, including four children, had been killed and 52 civilians had b een injured during clashes in Tripoli from 21 to 22 July.",Tripoli,32.88743,13.18733,LBY,Tripoli,,PPLC,158,165
S/2022/632_PAR_45_SEN_2,"In addition, the judicial police confirmed that one corrections officer at the Judaydah prison, in Tripoli, had been killed on 22 July when the prison was attacked during the armed clashes.",Judaydah,36.19454,36.4131,SYR,Idlib,,PPL,79,87
S/2022/632_PAR_45_SEN_2,"In addition, the judicial police confirmed that one corrections officer at the Judaydah prison, in Tripoli, had been killed on 22 July when the prison was attacked during the armed clashes.",Tripoli,34.43352,35.84415,LBN,Liban-Nord,,PPLA,99,106
S/2022/632_PAR_47_SEN_1,"From 22 to 25 May, UNSMIL, in cooperation with the Public Prosecution Service of Egypt, held a first training seminar for Libyan public prosecutors, in Cairo, to enhance investigation capacity to address corruption, terrorism, money laundering, trafficking in persons and organized crime.",Arab Republic of Egypt,27.0,30.0,EGY,,,PCLI,81,86
S/2022/632_PAR_47_SEN_1,"From 22 to 25 May, UNSMIL, in cooperation with the Public Prosecution Service of Egypt, held a first training seminar for Libyan public prosecutors, in Cairo, to enhance investigation capacity to address corruption, terrorism, money laundering, trafficking in persons and organized crime.",Cairo,30.06263,31.24967,EGY,Cairo,,PPLC,152,157
S/2022/632_PAR_51_SEN_1,"UNSMIL continued to receive concerning reports of harassment of and restrictions and violence against lawyers, including the arbitrary arrest of Ibrahim Page 9 Ghaniya on 18 July by the Deterrence Apparatus for Combating Organized Crime and Terrorism and the assault of Abdullah Ali Farahat on 19 July in a Tripoli court by the same group.",Tripoli,34.43352,35.84415,LBN,Liban-Nord,,PPLA,307,314
S/2022/632_PAR_52_SEN_2,"In Tubruq, 18 young men and 1 woman were arrested and arbitrarily detained on 3 July by the eastern branch of the Internal Security Agency.",Tobruk,32.08963,23.95385,LBY,Al Buţnān,,PPLA,3,9
S/2022/632_PAR_52_SEN_3,The men were referred to the prosecution office and the woman was transferred to the Rajmah facility and subsequently released.,Ar Rajmah,23.3022,57.55469,OMN,Al Batinah South,,PPL,85,91
S/2022/632_PAR_52_SEN_5,"According to credi ble sources, four men were arrested and arbitrarily detained in Tubruq by armed groups on 9 July.",Tobruk,32.08963,23.95385,LBY,Al Buţnān,,PPLA,83,89
S/2022/632_PAR_52_SEN_6,Some 35 other people allegedly detained in Tubruq in connection with the protests were transferred to Benghazi.,Tobruk,32.08963,23.95385,LBY,Al Buţnān,,PPLA,43,49
S/2022/632_PAR_52_SEN_6,Some 35 other people allegedly detained in Tubruq in connection with the protests were transferred to Benghazi.,Benghazi,32.11486,20.06859,LBY,Banghāzī,,PPLA,102,110
S/2022/632_PAR_53_SEN_1,"In Judaydah prison in Tripoli, 34 women an d 41 children allegedly associated with Da ’esh remained arbitrarily detained.",Judaydah,36.19454,36.4131,SYR,Idlib,,PPL,3,11
S/2022/632_PAR_53_SEN_1,"In Judaydah prison in Tripoli, 34 women an d 41 children allegedly associated with Da ’esh remained arbitrarily detained.",Tripoli,34.43352,35.84415,LBN,Liban-Nord,,PPLA,22,29
S/2022/632_PAR_54_SEN_1,"Conflict -related sexual violence continued to be reported, including as documented in the report of the Panel of Experts on Libya of 4 May ( S/2022/427 ), in which instances of the rape and sexual slavery of two girls in a secret detention facility in Bani Walid were reported.",Bani Walid,31.74554,13.98354,LBY,Mişrātah,,PPL,253,263
S/2022/632_PAR_55_SEN_1,"As at 30 June, the International Organization for Migration (IOM) reported 667,400 migrants in Libya, an increase of 17,600 migrants compared with the previous reporting period, suggesting a return to the migration dynamics previous to the coronavirus disease (COVID -19) pandemic.",Libya,28.0,17.0,LBY,,,PCLI,95,100
S/2022/632_PAR_55_SEN_2,Migrants and refugees continued to endure widespread human rights violations and faced serious huma nitarian and protection concerns in Libya.,Libya,28.0,17.0,LBY,,,PCLI,136,141
S/2022/632_PAR_56_SEN_1,"On 5 June, the Zuwarah municipal council declared that the activities of all international organizations working with migrants contradicted the city ’s policies on illegal migration and demanded that they leave the city immediately.",Zuwārah,32.9312,12.08199,LBY,An Nuqāţ al Khams,,PPLA,15,22
S/2022/632_PAR_56_SEN_3,"On 13 July, local security forces in Zuwarah carried out a mass arrest and detention of migrants and refugees.",Zuwārah,32.9312,12.08199,LBY,An Nuqāţ al Khams,,PPLA,37,44
S/2022/632_PAR_57_SEN_1,"As at 17 July, the number of people attempting to cross the Mediterranean remained high, with 12,063 individuals, including 769 women and 437 minors, having been intercepted and returned to Libya by the Libyan Coast Guard.",Mediterranean Sea,35.0,20.0,NA,,,SEA,60,73
S/2022/632_PAR_57_SEN_1,"As at 17 July, the number of people attempting to cross the Mediterranean remained high, with 12,063 individuals, including 769 women and 437 minors, having been intercepted and returned to Libya by the Libyan Coast Guard.",Libya,28.0,17.0,LBY,,,PCLI,190,195
S/2022/632_PAR_58_SEN_2,"UNSMIL, United Nations agencies and humanitarian partners continued to be denied access to official and unofficial detention centres, including the Ma ya detention centre in Tripoli, operated by the Stability Support Apparatus, where more than 2,600 migrants and refugees reportedly remained arbitrarily detained in inhumane and degrading conditions.",Mayagüez,18.20107,-67.13962,PRI,Mayagüez,Mayagüez Barrio-Pueblo,PPLA,148,153
S/2022/632_PAR_58_SEN_2,"UNSMIL, United Nations agencies and humanitarian partners continued to be denied access to official and unofficial detention centres, including the Ma ya detention centre in Tripoli, operated by the Stability Support Apparatus, where more than 2,600 migrants and refugees reportedly remained arbitrarily detained in inhumane and degrading conditions.",Tripoli,34.43352,35.84415,LBN,Liban-Nord,,PPLA,174,181
S/2022/632_PAR_58_SEN_3,"Serious concerns remained over the fates of several thou sand other people intercepted at sea and detained in Libya by a range of State and non -State armed actors, amounting to 11,230 individuals disembarked in 129 operations in 2022, as at 31 July.",Libya,28.0,17.0,LBY,,,PCLI,110,115
S/2022/632_PAR_60_SEN_1,"During Eid al -Adha, UNSMIL observed a wave of arbitrary arrests and the targeting of migrants celebrating the holiday in Misratah, Sabratah , Tripoli, Zuwarah and Zawiyah in western Libya.",Mişrātah,32.37535,15.09254,LBY,Mişrātah,,PPLA,122,130
S/2022/632_PAR_60_SEN_1,"During Eid al -Adha, UNSMIL observed a wave of arbitrary arrests and the targeting of migrants celebrating the holiday in Misratah, Sabratah , Tripoli, Zuwarah and Zawiyah in western Libya.",Şabrātah,32.79335,12.48845,LBY,Az Zāwiyah,,PPL,132,140
S/2022/632_PAR_60_SEN_1,"During Eid al -Adha, UNSMIL observed a wave of arbitrary arrests and the targeting of migrants celebrating the holiday in Misratah, Sabratah , Tripoli, Zuwarah and Zawiyah in western Libya.",Tripolitania,31.0,15.0,LBY,,,RGN,143,150
S/2022/632_PAR_60_SEN_1,"During Eid al -Adha, UNSMIL observed a wave of arbitrary arrests and the targeting of migrants celebrating the holiday in Misratah, Sabratah , Tripoli, Zuwarah and Zawiyah in western Libya.",Zuwārah,32.9312,12.08199,LBY,An Nuqāţ al Khams,,PPLA,152,159
